numero_registro;denominacion;plazas_autorizadas_numero;plazas_descripcion;tipologia;subtipo;sector;municipio_codigo;municipio_nombre;direccion_via_tipo;direccion_via_codigo;direccion_via_nombre;direccion_portal;direccion_coor_x;direccion_coor_y;direccion_codigo_postal;contacto_telefono;entidad_denominacion;entidad_cif;entidad_naturaleza
C2118;PISO TUTELADO APA-CEISFAS II;6;Plazas totales;CENTROS RESIDENCIALES;VIVIENDAS COMUNITARIAS;Personas con discapacidad intelectual;079;Madrid;CALLE;00365;de Andrés Torrejón;18;442128;4473251;28014;;ASOCIACIÓN DE FAMILIARES DE DISCAPACITADOS USUARIOS DEL CEISFAS (AFADUCE);G79931390;PRIVADA SIN ÁNIMO DE LUCRO
C2120;CENTRO DE DIA MADRID;75;Capacidad máxima simultánea;CENTROS DE DÍA;CENTROS DE DÍA: OTROS;Personas mayores;079;Madrid;CALLE;08671;de Seseña;32;435344;4472285;28024;917114168 / 699920938;CENTROS GERONTOLOGICOS DE DIA MADRID S.L;B82712217;PRIVADA CON ÁNIMO DE LUCRO
C2127;CLAVIJO, RESIDENCIA  DE PERSONAS MAYORES;20;Plazas totales;CENTROS RESIDENCIALES;RESIDENCIAS DE PERSONAS MAYORES DEPENDIENTES;Personas mayores;175;Villamantilla;CALLE;A0051;San Miguel;22;403987;4466454;28609;91 812 63 35;RESIDENCIA GERIATRICA CLAVIJO, SL;B86422631;PRIVADA CON ÁNIMO DE LUCRO
C2131;ARZOBISPO MORCILLO, RESIDENCIA DE PERSONAS MAYORES;78;Plazas totales;CENTROS RESIDENCIALES;RESIDENCIAS DE PERSONAS MAYORES DEPENDIENTES;Personas mayores;144;Soto del Real;AVDA;00317;Soto;2;434101;4511847;28791;918479254;RESIDENCIA TERCERA EDAD SOTO, S.A.;A82671595;PRIVADA CON ÁNIMO DE LUCRO
C2138;CASAVERDE NAVALCARNERO, RESIDENCIA DE PERSONAS MAYORES;146;Plazas totales;CENTROS RESIDENCIALES;RESIDENCIAS DE PERSONAS MAYORES DEPENDIENTES;Personas mayores;096;Navalcarnero;CALLE;C0014;Don José María lópez malla;3;;;28600;918112493;HOSPITALES Y CENTROS CASAVERDE MADRID, S.L.;B80832082;PRIVADA CON ÁNIMO DE LUCRO
C2141;LAS PRADERAS, CENTRO DE DIA;40;Capacidad máxima simultánea;CENTROS DE DÍA;CENTROS DE DÍA: OTROS;Personas mayores;115;Pozuelo de Alarcón;CTRA;A0350;Humera;69;432180;4476602;28224;673394017;PEREZ AGHA, S.L.;B84457308;PRIVADA CON ÁNIMO DE LUCRO
C2144;CENTRO DE DIA VIRGEN DEL CONSUELO;10;Capacidad máxima simultánea;CENTROS DE DÍA;CENTROS DE DÍA: OTROS;Personas mayores;040;Ciempozuelos;AVDA;A0171;de los Toreros;4;446314;4445283;28350;91 893 31 40;RESIDENCIA VIRGEN DEL CONSUELO, S.L.;B80458730;PRIVADA CON ÁNIMO DE LUCRO
C2146;FLOR DE RETAMA, RESIDENCIA DE PERSONAS MAYORES;20;Plazas totales;CENTROS RESIDENCIALES;RESIDENCIAS DE PERSONAS MAYORES DEPENDIENTES;Personas mayores;140;Serranillos del Valle;CALLE;A0069;Retama;15;425932;4451428;28979;918 175 8 01;KOLKWITZIA, S.L.;B84887264;PRIVADA CON ÁNIMO DE LUCRO
C2151;LA EDAD DE ORO, RESIDENCIA DE PERSONAS MAYORES;111;Plazas totales;CENTROS RESIDENCIALES;RESIDENCIAS DE PERSONAS MAYORES DEPENDIENTES;Personas mayores;004;Álamo, El;CALLE;00505;Príncipe de Asturias;1;415680;4454448;28607;918122285;SERENI ORIZZONTI 1 S.P.A. SUCURSAL ESPAÑA;W0057832H;PRIVADA CON ÁNIMO DE LUCRO
C2155;PASEO  IMPERIAL, RESIDENCIA DE PERSONAS MAYORES;495;Plazas totales;CENTROS RESIDENCIALES;RESIDENCIAS DE PERSONAS MAYORES DEPENDIENTES;Personas mayores;079;Madrid;PASEO;02859;Imperial;26;439184;4473045;28005;913648252;RESIDENCIAL NOGALES XXI, S.A.;A84546696;PRIVADA CON ÁNIMO DE LUCRO
C2157;CENTRO DE DIA PARA MAYORES EL BOSQUE;35;Capacidad máxima simultánea;CENTROS DE DÍA;CENTROS DE DÍA: OTROS;Personas mayores;079;Madrid;CALLE;04694;de Peñascales;14;443516;4475019;28028;915732828;UNIDAD DE TERAPIA OCUPACIONAL EL BOSQUE, S.L.L.;B82498536;PRIVADA CON ÁNIMO DE LUCRO
C2159;SANITAS RESIDENCIAL PUERTA DE HIERRO, RESIDENCIA DE PERSONAS MAYORES;53;Plazas totales;CENTROS RESIDENCIALES;RESIDENCIAS DE PERSONAS MAYORES MIXTA;Personas mayores;079;Madrid;CALLE;00199;de Alfonso Fernández Clausells;2;438595;4479209;28035;913980017;SANITAS MAYORES, S.L.;B58937178;PRIVADA CON ÁNIMO DE LUCRO
C2165;CENTRO DE DIA EL MADROÑAL;100;Capacidad máxima simultánea;CENTROS DE DÍA;CENTROS DE DÍA: OTROS;Personas con discapacidad intelectual;148;Torrejón de Ardoz;CALLE;00129;Joaquín Blume;18;459947;4476917;28850;916766283;ASTOR - ASOCIACIÓN DE PADRES CON HIJOS CON DISCAPACIDAD INTELECTUAL DE TORREJON DE ARDOZ;G28577328;PRIVADA SIN ÁNIMO DE LUCRO
C2169;CENTRO BELMONTE, RESIDENCIA DE PERSONAS MAYORES;49;Plazas totales;CENTROS RESIDENCIALES;RESIDENCIAS DE PERSONAS MAYORES DEPENDIENTES;Personas mayores;019;Belmonte de Tajo;CALLE;00085;Barrio Alto;35;471228;4442677;28390;91 874 74 11;REMAYMAD GESTION S. L.;B88233465;PRIVADA CON ÁNIMO DE LUCRO
C2174;CENTRO DE DIA LUZ CASANOVA;150;Capacidad máxima simultánea;CENTROS DE DÍA;CENTROS DE DÍA: OTROS;Otros grupos en situación de necesidad;079;Madrid;CALLE;03146;de José Marañón;15;;;28010;914454169;APOSTOLICAS DEL CORAZON DE JESUS COMUNIDAD DE OBRAS SOCIALES;R2800880C;PRIVADA SIN ÁNIMO DE LUCRO
C2175;LUZ CASANOVA, CENTRO DE ACOGIDA DE MUJERES MALTRATADAS;30;Plazas totales;CENTROS DE ACOGIDA;CENTROS DE MUJERES MALTRATADAS;Mujer;RESERVADO;RESERVADO;RESERVADO;RESERVADO;RESERVADO;RESERVADO;RESERVADO;RESERVADO;RESERVADO;RESERVADO;APOSTOLICAS DEL CORAZON DE JESUS COMUNIDAD DE OBRAS SOCIALES;R2800880C;PRIVADA SIN ÁNIMO DE LUCRO
C2178;VALLELUZ , CENTRO DE DIA;17;Capacidad máxima simultánea;CENTROS DE DÍA;CENTROS DE DÍA: OTROS;Personas mayores;079;Madrid;CALLE;00479;de Antonio Salvador;79;440190;4470708;28026;917923205;GONZALEZ MENENDEZ, MARIA MILAGROS;;PRIVADA CON ÁNIMO DE LUCRO
C2182;JAZMIN, CENTRO MUNICIPAL DE DIA;40;Capacidad máxima simultánea;CENTROS DE DÍA;CENTROS DE DÍA: OTROS;Personas mayores;079;Madrid;CALLE;08870;del Jazmín;48;443608;4481221;28033;91 383 65 20;AYUNTAMIENTO DE MADRID;P2807900B;PÚBLICA
C2183;JAZMIN, CENTRO MUNICIPAL INTEGRADO DE ATENCION A ENFERMOS DE ALZHEIMER;58;Plazas totales;CENTROS RESIDENCIALES;RESIDENCIAS DE PERSONAS MAYORES DEPENDIENTES;Personas mayores;079;Madrid;CALLE;08870;del Jazmín;48;443608;4481221;28033;91 383 65 20;AYUNTAMIENTO DE MADRID;P2807900B;PÚBLICA
C2184;NUESTRA  SEÑORA DEL ROSARIO (TORREJON), RESIDENCIA DE PERSONAS MAYORES;56;Plazas totales;CENTROS RESIDENCIALES;RESIDENCIAS DE PERSONAS MAYORES DEPENDIENTES;Personas mayores;148;Torrejón de Ardoz;CALLE;00234;Soledad;37;459596;4478760;28850;916752859;RESIDENCIA PARA MAYORES NUESTRA SEÑORA DEL ROSARIO S.L;B82810706;PRIVADA CON ÁNIMO DE LUCRO
C2185;BALLESOL ALCALA, RESIDENCIA DE PERSONAS MAYORES;273;Plazas totales;CENTROS RESIDENCIALES;RESIDENCIAS DE PERSONAS MAYORES DEPENDIENTES;Personas mayores;005;Alcalá de Henares;CALLE;04560;Octavio Paz;21;468826;4483551;28806;91 802 92 12;INTERCENTROS BALLESOL, S.A.;A79370599;PRIVADA CON ÁNIMO DE LUCRO
C2197;LOS CORTIJOS, RESIDENCIA PERSONAS MAYORES;57;Plazas totales;CENTROS RESIDENCIALES;RESIDENCIAS DE PERSONAS MAYORES DEPENDIENTES;Personas mayores;141;Sevilla la Nueva;CALLE;00095;Carril Antiguo;20;409956;4467043;28609;91 812 96 64;RESIDENCIA GERIATRICA LOS CORTIJOS, S.L;B82153164;PRIVADA CON ÁNIMO DE LUCRO
C2210;LA TEJERA, RESIDENCIA DE PERSONAS MAYORES;47;Plazas totales;CENTROS RESIDENCIALES;RESIDENCIAS DE PERSONAS MAYORES DEPENDIENTES;Personas mayores;068;Guadarrama;CALLE;00725;Géminis;13;411349;4500774;28430;918493757;CENTRO MAYORES TEJERA, S.L.;B82812835;PRIVADA CON ÁNIMO DE LUCRO
C2211;GREGORIO SANCHEZ, CENTRO DE DIA;33;Capacidad máxima simultánea;CENTROS DE DÍA;CENTROS DE DÍA: OTROS;Personas con discapacidad física;170;Villaconejos;CALLE;A0057;Ocaña;48;458628;4438952;28360;918938214;COMUNIDAD DE MADRID (CONSEJERIA DE POLITICAS SOCIALES, FAMILIAS, IGUALDAD Y NATALIDAD);S7800001E;PÚBLICA
C2212;SOTOFRESNOS, CENTRO RESIDENCIAL;115;Plazas totales;CENTROS RESIDENCIALES;RESIDENCIAS DE PERSONAS MAYORES DEPENDIENTES;Personas mayores;144;Soto del Real;AVDA;00600;de España;11;433344;4511700;28791;91 848 05 10;ASOCIACION SERVICIO INTEGRAL SECTORIAL PARA ANCIANOS (ASISPA);G28702504;PRIVADA SIN ÁNIMO DE LUCRO
C2214;LA AURORA DE NAVALCARNERO, CENTRO DE DIA;40;Capacidad máxima simultánea;CENTROS DE DÍA;CENTROS DE DÍA: OTROS;Personas mayores;096;Navalcarnero;PASEO;;de Don Miguel Ribagorda Gómez;1;;;28600;918111164;SUCESORES DE GANCEDO RODRIGUEZ, S.A.;A28029692;PRIVADA CON ÁNIMO DE LUCRO
C2218;PISO TUTELADO PROGRAMA ELLACURIA;10;Plazas totales;CENTROS RESIDENCIALES;PISOS TUTELADOS;Presos y ex reclusos;RESERVADO;RESERVADO;RESERVADO;RESERVADO;RESERVADO;RESERVADO;RESERVADO;RESERVADO;RESERVADO;RESERVADO;FUNDACION PADRE GARRALDA - HORIZONTES ABIERTOS;G83618850;PRIVADA SIN ÁNIMO DE LUCRO
C2219;HOGAR DEL JUBILADO DE VALDEPIELAGOS;25;Capacidad máxima simultánea;CENTROS DE DÍA;HOGARES Y CLUBES;Personas mayores;163;Valdepiélagos;CALLE;00045;de las Parras;12;460789;4512283;28170;918416048;AYUNTAMIENTO DE VALDEPIELAGOS;P2816300D;PÚBLICA
C2223;MUNICIPAL DE TORRES DE LA ALAMEDA NUESTRA SEÑORA DEL ROSARIO, RESIDENCIA PERSONAS MAYORES;112;Plazas totales;CENTROS RESIDENCIALES;RESIDENCIAS DE PERSONAS MAYORES DEPENDIENTES;Personas mayores;154;Torres de la Alameda;CALLE;A0110;Palmeras;3;469535;4471755;28813;91 886 30 61;AYUNTAMIENTO DE TORRES DE LA ALAMEDA;P2815400C;PÚBLICA
C2225;SAGRADA FAMILIA (LUIS LARRAINZA), RESIDENCIA PERSONAS MAYORES;27;Plazas totales;CENTROS RESIDENCIALES;RESIDENCIAS DE PERSONAS MAYORES DEPENDIENTES;Personas mayores;079;Madrid;CALLE;03524;de Luis Larrainza;46;443274;4478001;28002;914134115;RESIDENCIA TERCERA EDAD SAGRADA FAMILIA S.L.;B81956070;PRIVADA CON ÁNIMO DE LUCRO
C2226;NUESTRA CASA, RESIDENCIA DE PERSONAS MAYORES;140;Plazas totales;CENTROS RESIDENCIALES;RESIDENCIAS DE PERSONAS MAYORES DEPENDIENTES;Personas mayores;047;Collado Villalba;CALLE;01827;las Aguedas;2;415293;4499573;28400;91 849 38 54;COMUNIDAD DE MADRID (CONSEJERIA DE POLITICAS SOCIALES, FAMILIAS, IGUALDAD Y NATALIDAD);S7800001E;PÚBLICA
C2227;NUESTRA CASA, CENTRO DE DIA;45;Capacidad máxima simultánea;CENTROS DE DÍA;CENTROS DE DÍA: OTROS;Personas mayores;047;Collado Villalba;CALLE;01827;las Aguedas;2;415293;4499573;28400;91 849 38 54;COMUNIDAD DE MADRID (CONSEJERIA DE POLITICAS SOCIALES, FAMILIAS, IGUALDAD Y NATALIDAD);S7800001E;PÚBLICA
C2229;LOS LLANOS VITAL, RESIDENCIA PARA PERSONAS MAYORES;93;Plazas totales;CENTROS RESIDENCIALES;RESIDENCIAS DE PERSONAS MAYORES DEPENDIENTES;Personas mayores;010;Alpedrete;CALLE;00721;Miguel de Cervantes;2;413531;4499916;28439;91 851 08 88;VITALGER, S.A.;A82779620;PRIVADA CON ÁNIMO DE LUCRO
C2233;CENTRO DE MAYORES JUAN MUÑOZ;200;Capacidad máxima simultánea;CENTROS DE DÍA;HOGARES Y CLUBES;Personas mayores;074;Leganés;CALLE;A0091;el Charco;23;434716;4464517;28911;912489313;AYUNTAMIENTO DE LEGANES;P2807400C;PÚBLICA
C2234;CENTRO DE MAYORES GREGORIO MARAÑON;350;Capacidad máxima simultánea;CENTROS DE DÍA;HOGARES Y CLUBES;Personas mayores;074;Leganés;CALLE;A0251;Mayorazgo;25;436162;4465455;28915;912489237;AYUNTAMIENTO DE LEGANES;P2807400C;PÚBLICA
C2235;VUESTRA CASA II, RESIDENCIA PERSONAS MAYORES;27;Plazas totales;CENTROS RESIDENCIALES;RESIDENCIAS DE PERSONAS MAYORES DEPENDIENTES;Personas mayores;079;Madrid;CALLE;03921;de Martínez Izquierdo;37;443340;4476182;28028;917253067 / 917257904;VUESTRA CASA RESIDENCIA S.L.;B82982786;PRIVADA CON ÁNIMO DE LUCRO
C2239;PISO TUTELADO RENACER 8;5;Plazas totales;CENTROS RESIDENCIALES;PISOS TUTELADOS;Personas con discapacidad intelectual;079;Madrid;CALLE;06499;de Yerós;23;440697;4480304;28029;915543637 / 915547443;FUNDACION SER;G82725516;PRIVADA SIN ÁNIMO DE LUCRO
C2240;CENTRO DE DIA PARA ENFERMOS DE ALZHEIMER REINA SOFIA;110;Capacidad máxima simultánea;CENTROS DE DÍA;CENTROS DE DÍA: OTROS;Personas mayores;079;Madrid;CALLE;02872;de la Infanta Mercedes;26;440789;4478555;28020;91 425 14 23;CRUZ ROJA ESPAÑOLA;Q2866001G;PRIVADA SIN ÁNIMO DE LUCRO
C2242;CENTRO ESPIRAL, CENTRO DE DIA;45;Capacidad máxima simultánea;CENTROS DE DÍA;CENTROS DE DÍA: OTROS;Adolescencia;058;Fuenlabrada;URB;A0350;Nuevo Versalles;235;429274;4460739;28942;914869999/616077922;ASOCIACIÓN ESPIRAL LORANCA;G83983270;PRIVADA SIN ÁNIMO DE LUCRO
C2244;TREBOL CENTRO DE DIA;20;Capacidad máxima simultánea;CENTROS DE DÍA;CENTROS DE DÍA: OTROS;Personas mayores;079;Madrid;CALLE;04511;de Palomares;71;439330;4466612;28021;91 796 90 59;ANA ISABEL MARTINEZ RODRIGUEZ;;PRIVADA CON ÁNIMO DE LUCRO
C2246;COLMENAR DE OREJA RESIDENCIA PARA PERSONAS CON DISCAPACIDAD INTELECTUAL;32;Plazas totales;CENTROS RESIDENCIALES;OTRAS RESIDENCIAS;Personas con discapacidad intelectual;043;Colmenar de Oreja;CTRA;A0069;Colmenar de Oreja-Villarrubia;S/N;;;28380;918949755;COMUNIDAD DE MADRID (CONSEJERIA DE POLITICAS SOCIALES, FAMILIAS, IGUALDAD Y NATALIDAD);S7800001E;PÚBLICA
C2247;COLMENAR DE OREJA, CENTRO OCUPACIONAL;60;Capacidad máxima simultánea;CENTROS OCUPACIONALES;CENTROS OCUPACIONALES GENÉRICOS;Personas con discapacidad intelectual;043;Colmenar de Oreja;CTRA;A0069;Colmenar de Oreja-Villarrubia;S/N;;;28380;918943030;COMUNIDAD DE MADRID (CONSEJERIA DE POLITICAS SOCIALES, FAMILIAS, IGUALDAD Y NATALIDAD);S7800001E;PÚBLICA
C2250;MARAVILLAS, RESIDENCIA DE PERSONAS MAYORES;133;Plazas totales;CENTROS RESIDENCIALES;RESIDENCIAS DE PERSONAS MAYORES DEPENDIENTES;Personas mayores;031;Cadalso de los Vidrios;CALLE;00460;Eugenio Moreno Santiago;11;;;28640;913641037-678488628;CROYCA S.L.;B78075272;PRIVADA CON ÁNIMO DE LUCRO
C2253;NTRA. SRA. DEL SAGRARIO, CENTRO DE DIA Y REHABILITACIÓN PSICOSOCIAL;115;Capacidad máxima simultánea;CENTROS DE DÍA;CENTROS DE DÍA: OTROS;Personas con enfermedad mental crónica;079;Madrid;CALLE;03965;de Matilde Hernández;97;437399;4470891;28025;91 462 07 39;FUNDACION EL BUEN SAMARITANO;G82184615;PRIVADA SIN ÁNIMO DE LUCRO
C2260;COMEDOR DE LA OBRA SOCIAL SANTA MARIA JOSEFA;80;Capacidad máxima simultánea;CENTROS DE DÍA;CENTROS DE DÍA: OTROS;Otros grupos en situación de necesidad;079;Madrid;CALLE;01955;de Encarnación González;1;443309;4471423;28053;914771004;CASA COMUNIDAD CONGREGACION DE R.R. SIERVAS DE JESUS DE LA CARIDAD;R7900067E;PRIVADA SIN ÁNIMO DE LUCRO
C2261;MARIA ORUE, CENTRO DE DIA;45;Capacidad máxima simultánea;CENTROS DE DÍA;CENTROS DE DÍA: OTROS;Personas mayores;079;Madrid;CALLE;03804;de María Orue;1;441711;4467170;28021;917100484;COMUNIDAD DE MADRID (CONSEJERIA DE POLITICAS SOCIALES, FAMILIAS, IGUALDAD Y NATALIDAD);S7800001E;PÚBLICA
C2262;MARIA ORUE, PISOS TUTELADOS DE PERSONAS MAYORES;28;Plazas totales;CENTROS RESIDENCIALES;CENTROS RESIDENCIALES: OTROS;Personas mayores;079;Madrid;CALLE;03804;de María Orue;1;441711;4467170;28021;91 710 04 84;COMUNIDAD DE MADRID (CONSEJERIA DE POLITICAS SOCIALES, FAMILIAS, IGUALDAD Y NATALIDAD);S7800001E;PÚBLICA
C2263;ORPEA PUNTA GALEA, RESIDENCIA DE PERSONAS MAYORES;162;Plazas totales;CENTROS RESIDENCIALES;RESIDENCIAS DE PERSONAS MAYORES DEPENDIENTES;Personas mayores;127;Rozas de Madrid, Las;CALLE;02877;Playa del Sardinero;19;423739;4488090;28230;916369220- 600954807;SANYRES SUR, S.L.;B14601413;PRIVADA CON ÁNIMO DE LUCRO
C2264;CASER RESIDENCIAL ARTURO SORIA;140;Plazas totales;CENTROS RESIDENCIALES;RESIDENCIAS DE PERSONAS MAYORES DEPENDIENTES;Personas mayores;079;Madrid;CALLE;10944;de Puerto de Santa María;15;444755;4478374;28043;91 716 00 36;CASER RESIDENCIAL, S.A.;A81228520;PRIVADA CON ÁNIMO DE LUCRO
C2268;SAN MIGUEL ARCANGEL, RESIDENCIA DE PERSONAS MAYORES;46;Plazas totales;CENTROS RESIDENCIALES;RESIDENCIAS DE PERSONAS MAYORES DEPENDIENTES;Personas mayores;068;Guadarrama;CALLE;00831;de la Panera;1;408037;4502982;28440;91 854 77 22;"FUNDACION RESIDENCIA DE ANCIANOS DE GUADARRAMA ""SAN MIGUEL ARCANGEL""";G79285409;PRIVADA SIN ÁNIMO DE LUCRO
C2271;CENTRO OCUPACIONAL ESTAR LOS YEBENES;100;Capacidad máxima simultánea;CENTROS OCUPACIONALES;CENTROS OCUPACIONALES GENÉRICOS;Personas con discapacidad intelectual;079;Madrid;CALLE;08823;de los Yébenes;241;436261;4471447;28047;917194632 / 915543637;FUNDACION SER;G82725516;PRIVADA SIN ÁNIMO DE LUCRO
C2277;MONTEVERDE, RESIDENCIA PERSONAS MAYORES;27;Plazas totales;CENTROS RESIDENCIALES;RESIDENCIAS DE PERSONAS MAYORES DEPENDIENTES;Personas mayores;181;Villaviciosa de Odón;CALLE;A0230;Miño;35;421897;4471157;28670;916167199;RESIDENCIA DE TERCERA EDAD MONTE VERDE S.L.;B82188103;PRIVADA CON ÁNIMO DE LUCRO
C2279;RESIDENCIA DE PERSONAS MAYORES DE MORATALAZ;70;Plazas totales;CENTROS RESIDENCIALES;RESIDENCIAS DE PERSONAS MAYORES DEPENDIENTES;Personas mayores;079;Madrid;CALLE;09757;de Luis de Hoyos Sáinz;196;446578;4472378;28030;91 773 04 83 / 91 773 04 96;FUNDACION SANTA LUCIA;G28801553;PRIVADA SIN ÁNIMO DE LUCRO
C2280;SAN JUAN BAUTISTA (ALDEA DEL FRESNO), RESIDENCIA DE PERSONAS MAYORES;84;Plazas totales;CENTROS RESIDENCIALES;RESIDENCIAS DE PERSONAS MAYORES DEPENDIENTES;Personas mayores;008;Aldea del Fresno;CTRA;;M-507 (Navalcarnero-Cadalso);22;;;28620;918621045 / 918649001;FUNDACIÓN SUMMA HUMANITATE;G84657295;PRIVADA SIN ÁNIMO DE LUCRO
C2282;SANIVIDA CIUDAD LINEAL, CENTRO DE DIA PARA MAYORES;100;Capacidad máxima simultánea;CENTROS DE DÍA;CENTROS DE DÍA: OTROS;Personas mayores;079;Madrid;CALLE;00322;de Amós de Escalante;4;445517;4476239;28017;91 377 37 23;SANIVIDA, S.L.;B83649632;PRIVADA CON ÁNIMO DE LUCRO
C2287;SOTOFRESNOS, CENTRO DE DIA;50;Capacidad máxima simultánea;CENTROS DE DÍA;CENTROS DE DÍA: OTROS;Personas mayores;144;Soto del Real;AVDA;00600;de España;11;433344;4511700;28791;91 848 05 10;ASOCIACION SERVICIO INTEGRAL SECTORIAL PARA ANCIANOS (ASISPA);G28702504;PRIVADA SIN ÁNIMO DE LUCRO
C2288;SAN MIGUEL (VILLALBILLA), RESIDENCIA PERSONAS MAYORES;34;Plazas totales;CENTROS RESIDENCIALES;RESIDENCIAS DE PERSONAS MAYORES MIXTA;Personas mayores;172;Villalbilla;AVDA;00165;Reyes Magos;19;474243;4475906;28810;91 850 22 81;HOGAR PARA MAYORES SAN MIGUEL, S.L.;B82919531;PRIVADA CON ÁNIMO DE LUCRO
C2295;CENTRO DE DIA MUNICIPAL DE PERSONAS MAYORES DE GRIÑON;30;Capacidad máxima simultánea;CENTROS DE DÍA;CENTROS DE DÍA: OTROS;Personas mayores;066;Griñón;CALLE;00450;de la Ermita;1;427508;4452124;28971;91 814 06 71;AYUNTAMIENTO DE GRIÑON;P2806600I;PÚBLICA
C2296;BALLESOL MIRASIERRA, RESIDENCIA DE PERSONAS MAYORES;232;Plazas totales;CENTROS RESIDENCIALES;RESIDENCIAS DE PERSONAS MAYORES DEPENDIENTES;Personas mayores;079;Madrid;AVDA;11964;del Ventisquero de la Condesa;2;439399;4481726;28034;91 738 90 22 / 91 541 65 86;INTERCENTROS BALLESOL, S.A.;A79370599;PRIVADA CON ÁNIMO DE LUCRO
C2317;CENTRO DE DIA ASISTIDO EL VAL;55;Capacidad máxima simultánea;CENTROS DE DÍA;CENTROS DE DÍA: OTROS;Personas mayores;005;Alcalá de Henares;CMNO;A0252;de la Esgaravita;30;470233;4482248;28805;918824246;ASOCIACION SERVICIO INTEGRAL SECTORIAL PARA ANCIANOS (ASISPA);G28702504;PRIVADA SIN ÁNIMO DE LUCRO
C2318;CENTRO DE DIA ROQUE GARRIDO APANID;75;Capacidad máxima simultánea;CENTROS DE DÍA;CENTROS DE DÍA: OTROS;Personas con discapacidad intelectual;065;Getafe;PASEO;60694;de Tiselius;9;436861;4458480;28906;91 695 36 81;ASOCIACIÓN DE PADRES Y AMIGOS DE NIÑOS DIFERENTES DE GETAFE, COMUNIDAD DE MADRID Y TERRITORIO NACIONAL (APANID);G28389443;PRIVADA SIN ÁNIMO DE LUCRO
C2324;PISO TUTELADO II DE LA FUNDACION BETESDA;6;Plazas totales;CENTROS RESIDENCIALES;PISOS TUTELADOS;Personas con discapacidad intelectual;079;Madrid;CALLE;02546;de los Geranios;47;441231;4480455;28029;91 388 25 01 / 91 323 51 33;FUNDACION BETESDA;G81111502;PRIVADA SIN ÁNIMO DE LUCRO
C2326;LAS GOLONDRINAS DE ROBLEDO, RESIDENCIA DE  PERSONAS MAYORES;58;Plazas totales;CENTROS RESIDENCIALES;RESIDENCIAS DE PERSONAS MAYORES MIXTA;Personas mayores;125;Robledo de Chavela;CALLE;00230;de Miguel de Cervantes;40;393843;4486329;28294;918998541;GERIATRICA LAS GOLONDRINAS, SL;B86342839;PRIVADA CON ÁNIMO DE LUCRO
C2327;PISO TUTELADO I DE LA FUNDACION BETESDA;6;Plazas totales;CENTROS RESIDENCIALES;PISOS TUTELADOS;Personas con discapacidad intelectual;079;Madrid;CALLE;02546;de los Geranios;47;441231;4480455;28029;913 882 501/ 91 323 51 33;FUNDACION BETESDA;G81111502;PRIVADA SIN ÁNIMO DE LUCRO
C2328;MI CASA HERMANITAS DE LOS POBRES, RESIDENCIA PERSONAS MAYORES;93;Plazas totales;CENTROS RESIDENCIALES;RESIDENCIAS DE PERSONAS MAYORES MIXTA;Personas mayores;079;Madrid;CALLE;01736;del Doctor Esquerdo;49;443279;4474853;28028;91 574 29 88;HERMANITAS DE LOS POBRES PROVINCIA DE MADRID ASILO DE ANCIANOS DOCTOR ESQUERDO 49;R2800676E;PRIVADA SIN ÁNIMO DE LUCRO
C2331;PEÑUELAS, RESIDENCIA DE PERSONAS MAYORES;220;Plazas totales;CENTROS RESIDENCIALES;RESIDENCIAS DE PERSONAS MAYORES DEPENDIENTES;Personas mayores;079;Madrid;CALLE;00548;de Arganda;11;440068;4472504;28005;91 506 05 96;COMUNIDAD DE MADRID (CONSEJERIA DE POLITICAS SOCIALES, FAMILIAS, IGUALDAD Y NATALIDAD);S7800001E;PÚBLICA
C2332;PEÑUELAS, CENTRO DE DIA;45;Capacidad máxima simultánea;CENTROS DE DÍA;CENTROS DE DÍA: OTROS;Personas mayores;079;Madrid;CALLE;00548;de Arganda;11;440068;4472504;28005;915060596;COMUNIDAD DE MADRID (CONSEJERIA DE POLITICAS SOCIALES, FAMILIAS, IGUALDAD Y NATALIDAD);S7800001E;PÚBLICA
C2335;REINOSA, CENTRO OCUPACIONAL;75;Capacidad máxima simultánea;CENTROS OCUPACIONALES;CENTROS OCUPACIONALES GENÉRICOS;Personas con discapacidad intelectual;058;Fuenlabrada;CALLE;A0405;de Reinosa;26;431490;4461326;28941;628926166;FUNDACION AMAS SOCIAL;G83160416;PRIVADA SIN ÁNIMO DE LUCRO
C2336;DOMUSVI CHAMARTIN, CENTRO DE DIA;74;Capacidad máxima simultánea;CENTROS DE DÍA;CENTROS DE DÍA: OTROS;Personas mayores;079;Madrid;CALLE;00478;de Antonio Salcés;1;443130;4477420;28002;91 744 03 10;QUAVITAE SERVICIOS ASISTENCIALES, S.A.U.;A80106842;PRIVADA CON ÁNIMO DE LUCRO
C2340;CENTRO DE EMERGENCIA MUNICIPAL DE LEGANES;12;Plazas totales;CENTROS DE ACOGIDA;CENTROS DE MUJERES MALTRATADAS;Mujer;RESERVADO;RESERVADO;RESERVADO;RESERVADO;RESERVADO;RESERVADO;RESERVADO;RESERVADO;RESERVADO;RESERVADO;AYUNTAMIENTO DE LEGANES;P2807400C;PÚBLICA
C2343;LAS AZALEAS, RESIDENCIA PERSONAS MAYORES;67;Plazas totales;CENTROS RESIDENCIALES;RESIDENCIAS DE PERSONAS MAYORES DEPENDIENTES;Personas mayores;079;Madrid;CALLE;00911;de Bueso Pineda;52;444668;4478509;28043;913004951;ASOCIACION SERVICIO INTEGRAL SECTORIAL PARA ANCIANOS (ASISPA);G28702504;PRIVADA SIN ÁNIMO DE LUCRO
C2345;PISO TUTELADO CIRVITE ESPARTA 19-21, 1º;9;Plazas totales;CENTROS RESIDENCIALES;PISOS TUTELADOS;Personas con discapacidad intelectual;079;Madrid;CALLE;02028;de Esparta;19;447758;4477741;28022;91 324 92 93;ASOCIACION CIRCULO CONVIVENCIAL LIMITE CIRVITE;G28870558;PRIVADA SIN ÁNIMO DE LUCRO
C2346;PISO TUTELADO CIRVITE ESPARTA 19 21 2º;9;Plazas totales;CENTROS RESIDENCIALES;PISOS TUTELADOS;Personas con discapacidad intelectual;079;Madrid;CALLE;02028;de Esparta;19;447758;4477741;28022;913249293;ASOCIACION CIRCULO CONVIVENCIAL LIMITE CIRVITE;G28870558;PRIVADA SIN ÁNIMO DE LUCRO
C2347;PISO TUTELADO CIRVITE ESPARTA 3º;9;Plazas totales;CENTROS RESIDENCIALES;PISOS TUTELADOS;Personas con discapacidad intelectual;079;Madrid;CALLE;02028;de Esparta;19;447758;4477741;28022;91423 92 93;ASOCIACION CIRCULO CONVIVENCIAL LIMITE CIRVITE;G28870558;PRIVADA SIN ÁNIMO DE LUCRO
C2352;EL PARDO DE ARAVACA, RESIDENCIA PERSONAS MAYORES;88;Plazas totales;CENTROS RESIDENCIALES;RESIDENCIAS DE PERSONAS MAYORES DEPENDIENTES;Personas mayores;079;Madrid;CALLE;10173;de Darío Aparicio;33;434789;4480264;28023;917400490;NUEVA GERIATRIA, S.L.;B82218074;PRIVADA CON ÁNIMO DE LUCRO
C2359;PISO SAN RAFAEL;9;Plazas totales;CENTROS DE ACOGIDA;CENTROS DE ACOGIDA: OTROS;Otros grupos en situación de necesidad;079;Madrid;CALLE;08243;de La Bañeza;43;439146;4480656;28029;913863343;ASOCIACION CENTRO DE ACCION SOCIAL SAN RAFAEL;G78192457;PRIVADA SIN ÁNIMO DE LUCRO
C2361;AC SOLIDARIOS, RESIDENCIA DE PERSONAS MAYORES;32;Plazas totales;CENTROS RESIDENCIALES;RESIDENCIAS DE PERSONAS MAYORES DEPENDIENTES;Personas mayores;058;Fuenlabrada;PASEO;A0267;de Lisboa;9;431194;4458947;28943;916 002 633/916 002 634;AC SOLIDARIOS,S.L.;B81800765;PRIVADA CON ÁNIMO DE LUCRO
C2362;DON BOSCO, RESIDENCIA DE PERSONAS MAYORES;63;Plazas totales;CENTROS RESIDENCIALES;RESIDENCIAS DE PERSONAS MAYORES DEPENDIENTES;Personas mayores;079;Madrid;CALLE;45915;de la Playa de Riazor;39;450384;4480766;28042;913055087;ASOCIACION EDAD DORADA MENSAJEROS DE LA PAZ;G81594962;PRIVADA SIN ÁNIMO DE LUCRO
C2363;PISO TUTELADO PAULA MONTAL;11;Plazas totales;CENTROS RESIDENCIALES;PISOS TUTELADOS;Infancia;079;Madrid;CALLE;08605;de Tembleque;106;435173;4471527;28024;917112167 / 650705251;CONGREGACION HIJAS DE MARIA RELIGIOSAS DE LAS ESCUELAS PIAS. PROVINCIA DE CASTILLA;R2800111C;PRIVADA SIN ÁNIMO DE LUCRO
C2364;HESTIA, RESIDENCIA DE PERSONAS MAYORES;24;Plazas totales;CENTROS RESIDENCIALES;RESIDENCIAS DE PERSONAS MAYORES MIXTA;Personas mayores;045;Colmenar Viejo;CALLE;A0183;de las Hortensias;2;433852;4500361;28770;91 848 62 02;HESTIA ELDER HEALTHCARE, S.L.U.;B86717550;PRIVADA CON ÁNIMO DE LUCRO
C2366;CLINICA GERIATRICA LOS ANGELES, CENTRO DE DIA;40;Capacidad máxima simultánea;CENTROS DE DÍA;CENTROS DE DÍA: OTROS;Personas mayores;065;Getafe;AVDA;A0257;Ébanos;65;439212;4463648;28903;91 696 11 91;CLINICA GERIATRICA LOS ANGELES, S.L.;B82010604;PRIVADA CON ÁNIMO DE LUCRO
C2367;CLINICA GERIATRICA LOS ANGELES, RESIDENCIA DE PERSONAS MAYORES;180;Plazas totales;CENTROS RESIDENCIALES;RESIDENCIAS DE PERSONAS MAYORES DEPENDIENTES;Personas mayores;065;Getafe;AVDA;A0257;Ébanos;65;439212;4463648;28903;91 696 11 91;CLINICA GERIATRICA LOS ANGELES, S.L.;B82010604;PRIVADA CON ÁNIMO DE LUCRO
C2369;ORPEA SERRANILLOS DEL VALLE, RESIDENCIA DE PERSONAS MAYORES;120;Plazas totales;CENTROS RESIDENCIALES;RESIDENCIAS DE PERSONAS MAYORES DEPENDIENTES;Personas mayores;140;Serranillos del Valle;CALLE;A0069;Retama;2;425953;4451326;28979;91 813 81 38;ECOPLAR SERRANILLOS, S.A.;A82659442;PRIVADA CON ÁNIMO DE LUCRO
C2370;ORPEA SERRANILLOS DEL VALLE, CENTRO DE DIA;30;Capacidad máxima simultánea;CENTROS DE DÍA;CENTROS DE DÍA: OTROS;Personas mayores;140;Serranillos del Valle;CALLE;A0069;Retama;2;425953;4451326;28979;91 813 81 38;ECOPLAR SERRANILLOS, S.A.;A82659442;PRIVADA CON ÁNIMO DE LUCRO
