numero_registro;denominacion;plazas_autorizadas_numero;plazas_descripcion;tipologia;subtipo;sector;municipio_codigo;municipio_nombre;direccion_via_tipo;direccion_via_codigo;direccion_via_nombre;direccion_portal;direccion_coor_x;direccion_coor_y;direccion_codigo_postal;contacto_telefono;entidad_denominacion;entidad_cif;entidad_naturaleza
C3674;PISO I PROGRAMA-COLECTIVOS DE  PROVIVIENDA;5;Plazas totales;CENTROS RESIDENCIALES;PISOS TUTELADOS;Otros grupos en situación de necesidad;123;Rivas-Vaciamadrid;CALLE;00810;Rafael Canogar;4;455876;4465402;28529;91 557 01 37;ASOCIACION PROVIVIENDA;G79408696;PRIVADA SIN ÁNIMO DE LUCRO
C3680;JUAN  ESPAÑOL GRUPO 5, PSISO TUTELADO;3;Plazas totales;CENTROS RESIDENCIALES;PISOS TUTELADOS;Personas sin hogar;079;Madrid;CALLE;06868;de Juan Español;18;439765;4470924;28026;918119374- 686638594;GRUPO 5 ACCION Y GESTION SOCIAL S.A.U.;A78867371;PRIVADA CON ÁNIMO DE LUCRO
C3681;ORPEA ALCOBENDAS, RESIDENCIA PARA PERSONAS MAYORES (PLAN VELOCIDAD);180;Plazas totales;CENTROS RESIDENCIALES;RESIDENCIAS DE PERSONAS MAYORES DEPENDIENTES;Personas mayores;006;Alcobendas;AVDA;E0037;Miguel de Cervantes;3;444896;4488975;28100;914900678-609333969;ARTE VIDA CENTROS RESIDENCIALES, S.A.;A83790121;PRIVADA CON ÁNIMO DE LUCRO
C3682;ORPEA ALCOBENDAS, CENTRO DE DIA (PLAN VELOCIDAD);40;Capacidad máxima simultánea;CENTROS DE DÍA;CENTROS DE DÍA: OTROS;Personas mayores;006;Alcobendas;AVDA;E0037;Miguel de Cervantes;3;444896;4488975;28100;914900678;ARTE VIDA CENTROS RESIDENCIALES, S.A.;A83790121;PRIVADA CON ÁNIMO DE LUCRO
C3683;ORPEA LAS ROZAS, RESIDENCIA DE PERSONAS MAYORES (PLAN VELOCIDAD);180;Plazas totales;CENTROS RESIDENCIALES;RESIDENCIAS DE PERSONAS MAYORES DEPENDIENTES;Personas mayores;127;Rozas de Madrid, Las;CALLE;03145;Clara Campoamor;2;425402;4483962;28232;91 710 59 37;ARTE VIDA CENTROS RESIDENCIALES, S.A.;A83790121;PRIVADA CON ÁNIMO DE LUCRO
C3684;ORPEA LAS ROZAS, CENTRO DE DIA (PLAN VELOCIDAD);40;Capacidad máxima simultánea;CENTROS DE DÍA;CENTROS DE DÍA: OTROS;Personas mayores;127;Rozas de Madrid, Las;CALLE;03145;Clara Campoamor;2;425402;4483962;28232;91 710 59 37;ARTE VIDA CENTROS RESIDENCIALES, S.A.;A83790121;PRIVADA CON ÁNIMO DE LUCRO
C3685;PICO  ANAYET GRUPO5, PISO TUTELADO;4;Plazas totales;CENTROS RESIDENCIALES;PISOS TUTELADOS;Personas sin hogar;079;Madrid;CALLE;04741;de Pico Anayet;3;444202;4472636;28038;918119374-68663894;GRUPO 5 ACCION Y GESTION SOCIAL S.A.U.;A78867371;PRIVADA CON ÁNIMO DE LUCRO
C3686;PLAZA CASCORRO GRUPO 5, PISO TUTELADO;8;Plazas totales;CENTROS RESIDENCIALES;PISOS TUTELADOS;Personas sin hogar;079;Madrid;PLAZA;01197;de Cascorro;6;440000;4473566;28005;918119374-68663894;GRUPO 5 ACCION Y GESTION SOCIAL S.A.U.;A78867371;PRIVADA CON ÁNIMO DE LUCRO
C3687;VALLE BERGANTIÑOS GRUPO 5, PISO TUTELADO;3;Plazas totales;CENTROS RESIDENCIALES;PISOS TUTELADOS;Personas sin hogar;079;Madrid;CALLE;11740;del Valle de Bergantiños;6;439448;4479980;28039;918119374-68663594;GRUPO 5 ACCION Y GESTION SOCIAL S.A.U.;A78867371;PRIVADA CON ÁNIMO DE LUCRO
C3688;NARCISO SERRA GRUPO 5, PISO TUTELADO;5;Plazas totales;CENTROS RESIDENCIALES;PISOS TUTELADOS;Personas sin hogar;079;Madrid;CALLE;04255;de Narciso Serra;34;442499;4473087;28007;918119374-686638594;GRUPO 5 ACCION Y GESTION SOCIAL S.A.U.;A78867371;PRIVADA CON ÁNIMO DE LUCRO
C3690;SANTA MARIA DE LA CABEZA GRUPO 5, PISO TUTELADO;4;Plazas totales;CENTROS RESIDENCIALES;PISOS TUTELADOS;Personas sin hogar;079;Madrid;PASEO;05651;de Santa María de la Cabeza;16;441028;4473052;28045;918119374-686638594;GRUPO 5 ACCION Y GESTION SOCIAL S.A.U.;A78867371;PRIVADA CON ÁNIMO DE LUCRO
C3694;ALPAJES, PISO SUPERVISADO;4;Plazas totales;CENTROS RESIDENCIALES;PISOS TUTELADOS;Personas con enfermedad mental crónica;013;Aranjuez;CALLE;A0013;de Alpajes;60;449329;4432028;28300;918754930;HERMANAS HOSPITALARIAS DEL SAGRADO CORAZÓN DE JESÚS- CASA SANATORIO PSIQUIÁTRICO SAN MIGUEL;R2800745H;PRIVADA SIN ÁNIMO DE LUCRO
C3701;PISO SUPERVISADO FUENLABRADA 2 FUNDACION MANANTIAL;4;Plazas totales;CENTROS RESIDENCIALES;PISOS TUTELADOS;Personas con enfermedad mental crónica;058;Fuenlabrada;PLAZA;A0010;de la Albufera;11;432672;4460409;28945;912642377;FUNDACIÓN MANANTIAL;G81237257;PRIVADA SIN ÁNIMO DE LUCRO
C3706;LOS ROBLES GERHOTELES, RESIDENCIA DE PERSONAS MAYORES;170;Plazas totales;CENTROS RESIDENCIALES;RESIDENCIAS DE PERSONAS MAYORES MIXTA;Personas mayores;079;Madrid;CALLE;01860;de la Duquesa de Castrejón;19;444026;4479455;28033;917445280;DOCTOR PEREZ MATEOS, S.A.;A82520321;PRIVADA CON ÁNIMO DE LUCRO
C3707;PISO SUPERVISADO II GRUPO EXTER C/ DE LA ERA;4;Plazas totales;CENTROS RESIDENCIALES;PISOS TUTELADOS;Personas con enfermedad mental crónica;130;San Fernando de Henares;CALLE;00488;de la Era;40;454432;4475306;28830;916734470;GRUPO DE EXPERTOS EN TERAPIA Y REHABILITACIÓN, S.A.;A78629755;PRIVADA CON ÁNIMO DE LUCRO
C3708;PISO SUPERVISADO I GRUPO EXTER C/ VENEZUELA;4;Plazas totales;CENTROS RESIDENCIALES;PISOS TUTELADOS;Personas con enfermedad mental crónica;049;Coslada;CALLE;A0277;Venezuela;1;454021;4475720;28823;916734470;GRUPO DE EXPERTOS EN TERAPIA Y REHABILITACIÓN, S.A.;A78629755;PRIVADA CON ÁNIMO DE LUCRO
C3710;CENTRO DE MAYORES VIRGEN DE LA NUEVA, RESIDENCIA DE PERSONAS MAYORES;114;Plazas totales;CENTROS RESIDENCIALES;RESIDENCIAS DE PERSONAS MAYORES MIXTA;Personas mayores;133;San Martín de Valdeiglesias;CALLE;00085;de Manuel Carvajal;14;380673;4468723;28680;918679187;LA ADRABAR, S.L.;B05120381;PRIVADA CON ÁNIMO DE LUCRO
C3712;ARAVACA HERMANAS HOSPITALARIAS, PISO SUPERVISADO;4;Plazas totales;CENTROS RESIDENCIALES;PISOS TUTELADOS;Personas con enfermedad mental crónica;079;Madrid;CALLE;00543;de Arenas y Navarro;7;432447;4479967;28023;;HERMANAS HOSPITALARIAS DEL SAGRADO CORAZÓN DE JESÚS- CASA SANATORIO PSIQUIÁTRICO SAN MIGUEL;R2800745H;PRIVADA SIN ÁNIMO DE LUCRO
C3716;VIVIENDA UNIPERSONAL 2, ASOCIACIÓN REALIDADES;1;Plazas totales;CENTROS RESIDENCIALES;PISOS TUTELADOS;Personas sin hogar;079;Madrid;CALLE;05898;de Sombrerete;13;440376;4473312;28012;915277989/914672726;ASOCIACIÓN REALIDADES PARA LA INTEGRACIÓN SOCIAL;G80394711;PRIVADA SIN ÁNIMO DE LUCRO
C3717;VIVIENDA UNIPERSONAL 3, ASOCIACIÓN REALIDADES;1;Plazas totales;CENTROS RESIDENCIALES;PISOS TUTELADOS;Personas sin hogar;079;Madrid;CALLE;06124;de Tribulete;12;440400;4473268;28012;915277989 / 914672726;ASOCIACIÓN REALIDADES PARA LA INTEGRACIÓN SOCIAL;G80394711;PRIVADA SIN ÁNIMO DE LUCRO
C3718;VIVIENDA UNIPERSONAL 4, ASOCIACIÓN REALIDADES;1;Plazas totales;CENTROS RESIDENCIALES;PISOS TUTELADOS;Personas sin hogar;079;Madrid;CALLE;03995;del Mediodía Grande;20;439621;4473523;28005;915277989/914672726;ASOCIACIÓN REALIDADES PARA LA INTEGRACIÓN SOCIAL;G80394711;PRIVADA SIN ÁNIMO DE LUCRO
C3719;VIVIENDA UNIPERSONAL 5, ASOCIACIÓN REALIDADES;1;Plazas totales;CENTROS RESIDENCIALES;PISOS TUTELADOS;Personas sin hogar;079;Madrid;CALLE;00096;del Alamillo;2;439596;4473923;28005;915277989/914672726;ASOCIACIÓN REALIDADES PARA LA INTEGRACIÓN SOCIAL;G80394711;PRIVADA SIN ÁNIMO DE LUCRO
C3723;NUESTRA SEÑORA DE LA SOLEDAD (PARLA), RESIDENCIA DE PERSONAS MAYORES;54;Plazas totales;CENTROS RESIDENCIALES;RESIDENCIAS DE PERSONAS MAYORES DEPENDIENTES;Personas mayores;106;Parla;CALLE;00878;Gladiolo;1;433854;4453972;28981;916644443;FUNDACION HERMANDAD DE NUESTRA SEÑORA DE LA SOLEDAD PARLA;G84700194;PRIVADA SIN ÁNIMO DE LUCRO
C3727;PISO SUPERVISADO PARLA II, FUNDACION MANANTIAL;4;Plazas totales;CENTROS RESIDENCIALES;PISOS TUTELADOS;Personas con enfermedad mental crónica;106;Parla;CALLE;00005;Alfonso X El Sabio;45;434759;4453748;28982;91 371 72 92;FUNDACIÓN MANANTIAL;G81237257;PRIVADA SIN ÁNIMO DE LUCRO
C3729;ARGANDA, CENTRO DE DIA;30;Capacidad máxima simultánea;CENTROS DE DÍA;CENTROS DE DÍA: OTROS;Personas mayores;014;Arganda del Rey;CALLE;A0109;de la Dehesa;1;462829;4460932;28500;91 871 33 00;AGENCIA MADRILEÑA DE ATENCION SOCIAL (AMAS);Q2801283I;PÚBLICA
C3735;CENTRO DE REHABILITACION LABORAL CARABANCHEL;50;Capacidad máxima simultánea;CENTROS DE REHABILITACIÓN;CENTROS DE REHABILITACIÓN: OTROS;Personas con enfermedad mental crónica;079;Madrid;CMNO;02878;de los Ingenieros;13;436570;4470889;28047;91 525 21 40;FUNDACION EL BUEN SAMARITANO;G82184615;PRIVADA SIN ÁNIMO DE LUCRO
C3740;MIAL SALUD, RESIDENCIA DE PERSONAS MAYORES;174;Plazas totales;CENTROS RESIDENCIALES;RESIDENCIAS DE PERSONAS MAYORES DEPENDIENTES;Personas mayores;152;Torrelodones;AVDA;10707;de los Pinares;2;424162;4491216;28250;918597575;MIAL S.L;B78823200;PRIVADA CON ÁNIMO DE LUCRO
C3741;MIAL SALUD, CENTRO DE DIA DE PERSONAS MAYORES;30;Capacidad máxima simultánea;CENTROS DE DÍA;CENTROS DE DÍA: OTROS;Personas mayores;152;Torrelodones;AVDA;10707;de los Pinares;2;424162;4491216;28250;918597575;MIAL S.L;B78823200;PRIVADA CON ÁNIMO DE LUCRO
C3745;SAN FIDEL GRUPO 5, PISO TUTELADO;5;Plazas totales;CENTROS RESIDENCIALES;PISOS TUTELADOS;Otros grupos en situación de necesidad;079;Madrid;CALLE;05440;de San Fidel;85;445790;4475449;28017;686638594/918116374;GRUPO 5 ACCION Y GESTION SOCIAL S.A.U.;A78867371;PRIVADA CON ÁNIMO DE LUCRO
C3750;MARGARITA RETUERTO, CENTRO MUNICIPAL DE DIA PARA ENFERMOS DE ALZHEIMER;95;Capacidad máxima simultánea;CENTROS DE DÍA;CENTROS DE DÍA: OTROS;Personas mayores;079;Madrid;CALLE;08680;de Francisco Altimiras;4;443712;4476151;28028;917241448;AYUNTAMIENTO DE MADRID;P2807900B;PÚBLICA
C3751;MARGARITA RETUERTO, RESIDENCIA MUNICIPAL PARA ENFERMOS DE ALZHEIMER;92;Plazas totales;CENTROS RESIDENCIALES;RESIDENCIAS DE PERSONAS MAYORES DEPENDIENTES;Personas mayores;079;Madrid;CALLE;08680;de Francisco Altimiras;4;443712;4476151;28028;917241448;AYUNTAMIENTO DE MADRID;P2807900B;PÚBLICA
C3753;PISO TUTELADO OLIVA;5;Plazas totales;CENTROS RESIDENCIALES;PISOS TUTELADOS;Personas con discapacidad intelectual;113;Pinto;CALLE;C0013;Manuel Millares;2;440456;4455820;28320;916923952;ASOCIACIÓN DE MINUSVÁLIDOS DE PINTO;G79182275;PRIVADA SIN ÁNIMO DE LUCRO
C3754;PISO TUTELADO OLIVA II;6;Plazas totales;CENTROS RESIDENCIALES;PISOS TUTELADOS;Personas con discapacidad intelectual;113;Pinto;CALLE;C0013;Manuel Millares;2;440456;4455820;28320;916923952;ASOCIACIÓN DE MINUSVÁLIDOS DE PINTO;G79182275;PRIVADA SIN ÁNIMO DE LUCRO
C3756;SANTA ENGRACIA, CENTRO MUNICIPAL RESIDENCIAL;36;Plazas totales;CENTROS RESIDENCIALES;RESIDENCIAS DE PERSONAS MAYORES MIXTA;Personas mayores;079;Madrid;CALLE;03075;de Santa Engracia;118;440569;4476853;28003;919907720;AYUNTAMIENTO DE MADRID;P2807900B;PÚBLICA
C3757;DOMUSVI ESPARTALES, RESIDENCIA DE PERSONAS MAYORES;142;Plazas totales;CENTROS RESIDENCIALES;RESIDENCIAS DE PERSONAS MAYORES DEPENDIENTES;Personas mayores;005;Alcalá de Henares;AVDA;92913;Gustavo Adolfo Bécquer;27;468302;4484576;28805;918842027-695151130;SERVIGER XXI ALCALA S.L.;B47764238;PRIVADA CON ÁNIMO DE LUCRO
C3758;CENTRO DE REHABILITACION LABORAL FUENCARRAL;50;Capacidad máxima simultánea;CENTROS DE REHABILITACIÓN;CENTROS DE REHABILITACIÓN: OTROS;Personas con enfermedad mental crónica;079;Madrid;CALLE;10814;de Alfredo Marquerie;11;440836;4482035;28034;911291601;GRUPO 5 ACCION Y GESTION SOCIAL S.A.U.;A78867371;PRIVADA CON ÁNIMO DE LUCRO
C3761;APSURIA VIRGEN DE NURIA,CENTRO DE DIA;75;Capacidad máxima simultánea;CENTROS DE DÍA;CENTROS DE DÍA: OTROS;Personas con discapacidad intelectual;006;Alcobendas;CALLE;E0029;Anabel Segura;12;446799;4487254;28108;916622498;FUNDACION APSURIA;G85251627;PRIVADA SIN ÁNIMO DE LUCRO
C3762;APSURIA VIRGEN DE NURIA, RESIDENCIA PARA PERSONAS CON DISCAPACIDAD;70;Plazas totales;CENTROS RESIDENCIALES;OTRAS RESIDENCIAS;Personas con discapacidad intelectual;006;Alcobendas;CALLE;E0029;Anabel Segura;12;446799;4487254;28108;916622498;FUNDACION APSURIA;G85251627;PRIVADA SIN ÁNIMO DE LUCRO
C3765;ORPEA SAN BLAS, RESIDENCIA PARA PERSONAS MAYORES (PLAN VELOCIDAD);180;Plazas totales;CENTROS RESIDENCIALES;RESIDENCIAS DE PERSONAS MAYORES DEPENDIENTES;Personas mayores;079;Madrid;CALLE;45404;de Zurich;16;448776;4474853;28022;917759991;ARTE VIDA CENTROS RESIDENCIALES, S.A.;A83790121;PRIVADA CON ÁNIMO DE LUCRO
C3766;ORPEA SAN BLAS, CENTRO DE DIA (PLAN VELOCIDAD);40;Capacidad máxima simultánea;CENTROS DE DÍA;CENTROS DE DÍA: OTROS;Personas mayores;079;Madrid;CALLE;45404;de Zurich;16;448776;4474853;28022;917759991;ARTE VIDA CENTROS RESIDENCIALES, S.A.;A83790121;PRIVADA CON ÁNIMO DE LUCRO
C3768;APADIS CENTRO OCUPACIONAL PERSONAS CON DISCAPACIDAD PSIQUICA;110;Capacidad máxima simultánea;CENTROS OCUPACIONALES;CENTROS OCUPACIONALES GENÉRICOS;Personas con discapacidad intelectual;134;San Sebastián de los Reyes;AVDA;00789;de Aragón;14;446212;4489986;28702;916544207;ASOCIACION DE PADRES DE PERSONAS CON DISCAPACIDAD DE SAN SEBASTIAN DE LOS REYES;G28824043;PRIVADA SIN ÁNIMO DE LUCRO
C3769;APADIS, CENTRO DE DIA;60;Capacidad máxima simultánea;CENTROS DE DÍA;CENTROS DE DÍA: OTROS;Personas con discapacidad intelectual;134;San Sebastián de los Reyes;AVDA;00789;de Aragón;14;446212;4489986;28702;91- 654 42 07;ASOCIACION DE PADRES DE PERSONAS CON DISCAPACIDAD DE SAN SEBASTIAN DE LOS REYES;G28824043;PRIVADA SIN ÁNIMO DE LUCRO
C3770;RESIDENCIA PARA PERSONAS CON DISCAPACIDAD INTELECTUAL CON GRAVES TRASTORNOS DE CONDUCTA;38;Plazas totales;CENTROS RESIDENCIALES;OTRAS RESIDENCIAS;Personas con discapacidad intelectual;134;San Sebastián de los Reyes;AVDA;00789;de Aragón;14;446212;4489986;28702;916 544 207;ASOCIACION DE PADRES DE PERSONAS CON DISCAPACIDAD DE SAN SEBASTIAN DE LOS REYES;G28824043;PRIVADA SIN ÁNIMO DE LUCRO
C3776;SANITAS RESIDENCIAL GUADARRAMA VIRGEN DE LA CABEZA, RESIDENCIA DE PERSONAS MAYORES;170;Plazas totales;CENTROS RESIDENCIALES;RESIDENCIAS DE PERSONAS MAYORES DEPENDIENTES;Personas mayores;068;Guadarrama;PASEO;A0005;de la Alameda;8;407661;4503271;28440;918543893;SANITAS MAYORES, S.L.;B58937178;PRIVADA CON ÁNIMO DE LUCRO
C3784;RESIDENCIA AFANIAS-TORRELAGUNA;48;Plazas totales;CENTROS RESIDENCIALES;OTRAS RESIDENCIAS;Personas con discapacidad intelectual;151;Torrelaguna;CALLE;C0018;Afanias;9;455273;4520001;28180;918485711;AFANIAS, ASOCIACION PRO-PERSONAS CON DISCAPACIDAD INTELECTUAL;G28303790;PRIVADA SIN ÁNIMO DE LUCRO
C3785;CENTRO DE DIA COMUNIDAD DE SAN EGIDIO;85;Capacidad máxima simultánea;CENTROS DE DÍA;CENTROS DE DÍA: OTROS;Personas sin hogar;079;Madrid;CALLE;04403;del Olivar;1;440473;4473741;28012;639 124 449;ASOCIACION CULTURAL DE AYUDA DE LA COMUNIDAD DE SAN EGIDIO, DE ESPAÑA;G80043151;PRIVADA SIN ÁNIMO DE LUCRO
C3786;FUNDACION NUESTRA SEÑORA DEL CAMINO, RESIDENCIA DE PERSONAS MAYORES;72;Plazas totales;CENTROS RESIDENCIALES;RESIDENCIAS DE PERSONAS MAYORES MIXTA;Personas mayores;079;Madrid;CALLE;11990;de Collado de Tirobarra;6;439299;4482995;28034;917364794;FUNDACION NUESTRA SEÑORA DEL CAMINO;G28781722;PRIVADA SIN ÁNIMO DE LUCRO
C3787;AMAVIR HUMANES, RESIDENCIA DE PERSONAS MAYORES (PLAN VELOCIDAD);180;Plazas totales;CENTROS RESIDENCIALES;RESIDENCIAS DE PERSONAS MAYORES DEPENDIENTES;Personas mayores;073;Humanes de Madrid;AVDA;00453;de los Deportes;14;430598;4455412;28970;916040532;PLANIGER, S.A.;A83151977;PRIVADA CON ÁNIMO DE LUCRO
C3788;AMAVIR HUMANES, CENTRO DE DIA (PLAN VELOCIDAD);40;Capacidad máxima simultánea;CENTROS DE DÍA;CENTROS DE DÍA: OTROS;Personas mayores;073;Humanes de Madrid;AVDA;00453;de los Deportes;12;430414;4455471;28970;916040532;PLANIGER, S.A.;A83151977;PRIVADA CON ÁNIMO DE LUCRO
C3789;VITALIA PARLA, CENTRO DE DIA;45;Capacidad máxima simultánea;CENTROS DE DÍA;CENTROS DE DÍA: OTROS;Personas mayores;106;Parla;CALLE;00045;Fernando III El Santo;17;434679;4453849;28980;912830190;VITALIA HOME SL;B99438806;PRIVADA CON ÁNIMO DE LUCRO
C3791;LAS ROSAS, RESIDENCIA DE MAYORES;44;Plazas totales;CENTROS RESIDENCIALES;RESIDENCIAS DE PERSONAS MAYORES MIXTA;Personas mayores;079;Madrid;CALLE;09446;del Butrón;14;448304;4475103;28022;913130954;TALITA 2018 S. L.;B88103734;PRIVADA CON ÁNIMO DE LUCRO
C3796;ORPEA MADRID LORETO, RESIDENCIA DE PERSONAS MAYORES;210;Plazas totales;CENTROS RESIDENCIALES;RESIDENCIAS DE PERSONAS MAYORES DEPENDIENTES;Personas mayores;079;Madrid;AVDA;05140;de la Reina Victoria;62;439524;4477549;28003;915 357 716 / 600 954 817;SANYRES SUR, S.L.;B14601413;PRIVADA CON ÁNIMO DE LUCRO
C3797;ALBA II CENTRO DE DIA;24;Capacidad máxima simultánea;CENTROS DE DÍA;CENTROS DE DÍA: OTROS;Personas mayores;041;Cobeña;CALLE;00161;Viñuelas;2;457772;4491234;28863;;ALBA II RESIDENCIA GERIATRICA, S.L.;B81794265;PRIVADA CON ÁNIMO DE LUCRO
C3799;ARTURO PAJUELO, CENTRO MUNICIPAL DE MAYORES;210;Capacidad máxima simultánea;CENTROS DE DÍA;HOGARES Y CLUBES;Personas mayores;079;Madrid;CALLE;05734;de Segura;S/N;;;28041;913412030;AYUNTAMIENTO DE MADRID;P2807900B;PÚBLICA
C3801;CARMEN SEVILLA I, CENTRO DE DIA;26;Capacidad máxima simultánea;CENTROS DE DÍA;CENTROS DE DÍA: OTROS;Personas con discapacidad intelectual;079;Madrid;CALLE;45103;de Gabriel Montero;1;446467;4475085;28017;913274040;FUNDACION ANDE;G79812517;PRIVADA SIN ÁNIMO DE LUCRO
C3803;APADIS RESIDENCIA PERSONAS CON DISCAPACIDAD GRAVEMENTE AFECTADOS;30;Plazas totales;CENTROS RESIDENCIALES;OTRAS RESIDENCIAS;Personas con discapacidad intelectual;134;San Sebastián de los Reyes;AVDA;00789;de Aragón;14;446212;4489986;28702;916 544 207;ASOCIACION DE PADRES DE PERSONAS CON DISCAPACIDAD DE SAN SEBASTIAN DE LOS REYES;G28824043;PRIVADA SIN ÁNIMO DE LUCRO
C3804;CENTRO PISOS TUTELADOS  DE PERSONAS MAYORES DE LEGANES;135;Plazas totales;CENTROS RESIDENCIALES;CENTROS RESIDENCIALES: OTROS;Personas mayores;074;Leganés;CALLE;03164;Braganza;3;433322;4467728;28919;91 481 62 40 / 41;COMUNIDAD DE MADRID (CONSEJERIA DE POLITICAS SOCIALES, FAMILIAS, IGUALDAD Y NATALIDAD);S7800001E;PÚBLICA
C3806;SAN VICENTE DE PAUL, CENTRO MUNICIPAL DE MAYORES;340;Capacidad máxima simultánea;CENTROS DE DÍA;HOGARES Y CLUBES;Personas mayores;079;Madrid;CALLE;00424;de Antonia Lancha;54;438633;4470862;28044;915655633;AYUNTAMIENTO DE MADRID;P2807900B;PÚBLICA
C3812;CENTRO DE DIA PARQUE POLVORANCA;120;Capacidad máxima simultánea;CENTROS DE DÍA;CENTROS DE DÍA: OTROS;Personas con discapacidad intelectual;074;Leganés;CALLE;C0027;Parla;1;433530;4462841;28914;916 945 306;FUNDACION AMAS SOCIAL;G83160416;PRIVADA SIN ÁNIMO DE LUCRO
C3813;PARQUE POLVORANCA, OTRAS RESIDENCIAS;75;Plazas totales;CENTROS RESIDENCIALES;OTRAS RESIDENCIAS;Personas con discapacidad intelectual;074;Leganés;CALLE;C0027;Parla;1;433530;4462841;28914;916 945 306;FUNDACION AMAS SOCIAL;G83160416;PRIVADA SIN ÁNIMO DE LUCRO
C3814;ALTEA CENTRO DE  ATENCION TEMPRANA Y TRATAMIENTOS;22;Capacidad máxima simultánea;CENTROS DE REHABILITACIÓN;CENTROS DE ATENCIÓN;Infancia y Adolescencia;079;Madrid;CALLE;00548;de Arganda;34;440023;4472355;28005;915 307 153;ALTEA ATENCION TEMPRANA SL;B85271153;PRIVADA CON ÁNIMO DE LUCRO
C3817;PISO TUTELADO PROYECTO LAR POLVORANCA;5;Plazas totales;CENTROS RESIDENCIALES;PISOS TUTELADOS;Personas sin hogar;074;Leganés;CALLE;C0040;Alcalde Saturnino del Yerro Alonso;31;433110;4462748;28914;915277989;ASOCIACIÓN REALIDADES PARA LA INTEGRACIÓN SOCIAL;G80394711;PRIVADA SIN ÁNIMO DE LUCRO
C3818;CENTRO DE ATENCION RAFAEL CATTARINI;45;Capacidad máxima simultánea;CENTROS DE REHABILITACIÓN;CENTROS DE ATENCIÓN;Personas con discapacidad física;079;Madrid;CALLE;01929;de Emilia;51;440812;4480382;28029;913113530;"ASOCIACION ""ADELA MADRID""";G84767243;PRIVADA SIN ÁNIMO DE LUCRO
C3819;PISO TUTELADO ORDICIA WALK;4;Plazas totales;CENTROS RESIDENCIALES;PISOS TUTELADOS;Personas con enfermedad mental crónica;079;Madrid;CALLE;46043;de Ordicia;28;439310;4468715;28041;914282626;WALK REHABILITACIÓN Y DESARROLLO INTEGRAL S.L.;B83119834;PRIVADA CON ÁNIMO DE LUCRO
C3821;ACHALAY CENTRO DE DIA;22;Capacidad máxima simultánea;CENTROS DE DÍA;CENTROS DE DÍA: OTROS;Infancia y Adolescencia;079;Madrid;CALLE;06193;de Valdecanillas;53;447032;4476013;28037;913756911;ASOCIACIÓN ACHALAY ESPAÑA;G83506477;PRIVADA SIN ÁNIMO DE LUCRO
C3823;PROGRAMA INTEGRACION DE REFUGIADOS CEAR II;6;Plazas totales;CENTROS RESIDENCIALES;PISOS TUTELADOS;Refugiados y asilados;074;Leganés;CALLE;A0302;Pablo Freire;7;434305;4465596;28918;915550698;ASOCIACION COMISION ESPAÑOLA DE AYUDA AL REFUGIADO;G28651529;PRIVADA SIN ÁNIMO DE LUCRO
C3825;PROGRAMA DE ACOGIDA TEMPORAL CEAR I;6;Plazas totales;CENTROS RESIDENCIALES;PISOS TUTELADOS;Refugiados y asilados;079;Madrid;CALLE;00631;de la Asunción;18;440489;4470594;28026;915550698;ASOCIACION COMISION ESPAÑOLA DE AYUDA AL REFUGIADO;G28651529;PRIVADA SIN ÁNIMO DE LUCRO
C3827;PROGRAMA DE ACOGIDA TEMPORAL CEAR III;8;Plazas totales;CENTROS RESIDENCIALES;PISOS TUTELADOS;Refugiados y asilados;074;Leganés;CALLE;A0003;de la Acacia;17;434224;4465505;28918;915550698;ASOCIACION COMISION ESPAÑOLA DE AYUDA AL REFUGIADO;G28651529;PRIVADA SIN ÁNIMO DE LUCRO
C3835;CENTRO DE DIA SAGRADA FAMILIA;7;Capacidad máxima simultánea;CENTROS DE DÍA;CENTROS DE DÍA: OTROS;Personas mayores;079;Madrid;CALLE;03692;de Manuel Nieto;1;438541;4479962;28035;913862065;FUNDACION SAGRADA FAMILIA Y SANTA ISABEL;G78473741;PRIVADA SIN ÁNIMO DE LUCRO
C3837;SAN VICENTE DE PAUL 2, CENTRO MUNICIPAL DE DIA PARA DEPENDIENTES FUNCIONALES;45;Capacidad máxima simultánea;CENTROS DE DÍA;CENTROS DE DÍA: OTROS;Personas mayores;079;Madrid;CALLE;00424;de Antonia Lancha;54;438633;4470862;28019;915690673;AYUNTAMIENTO DE MADRID;P2807900B;PÚBLICA
C3838;CENTRO DE DIA: ATENCION SOCIOEDUCATIVA;20;Capacidad máxima simultánea;CENTROS DE DÍA;CENTROS DE DÍA: OTROS;(Inmigracion) Otros grupos en situación de necesidad;079;Madrid;CALLE;02045;de Espoz y Mina;16;440407;4474118;28012;917010117;ASOCIACION LUMBRE CENTRO DE FORMACION Y ATENCION SOCIOEDUCATIVA;G85234060;PRIVADA SIN ÁNIMO DE LUCRO
C3849;ARIS ATENCION TEMPRANA;26;Capacidad máxima simultánea;CENTROS DE REHABILITACIÓN;CENTROS DE ATENCIÓN;Infancia;079;Madrid;CALLE;00275;de Álvarez Abellán;6;437796;4470761;28025;914626222 / 656721251;ARIS ATENCION MULTIDISCIPLINAR INFANTIL SLU;B85328508;PRIVADA CON ÁNIMO DE LUCRO
C3852;ORPEA SANCHINARRO, CENTRO DE DIA (PLAN VELOCIDAD);40;Capacidad máxima simultánea;CENTROS DE DÍA;CENTROS DE DÍA: OTROS;Personas mayores;079;Madrid;CALLE;45990;de los Padres Dominicos;2;444396;4483691;28050;917502138;ARTE VIDA CENTROS RESIDENCIALES, S.A.;A83790121;PRIVADA CON ÁNIMO DE LUCRO
C3853;ORPEA SANCHINARRO, RESIDENCIA PARA PERSONAS MAYORES (PLAN VELOCIDAD);180;Plazas totales;CENTROS RESIDENCIALES;RESIDENCIAS DE PERSONAS MAYORES DEPENDIENTES;Personas mayores;079;Madrid;CALLE;45990;de los Padres Dominicos;2;444396;4483691;28050;917502138;ARTE VIDA CENTROS RESIDENCIALES, S.A.;A83790121;PRIVADA CON ÁNIMO DE LUCRO
C3854;EL SANTO CRISTO DEL NOGAL, RESIDENCIA DE PERSONAS MAYORES;20;Plazas totales;CENTROS RESIDENCIALES;RESIDENCIAS DE PERSONAS MAYORES DEPENDIENTES;Personas mayores;079;Madrid;CALLE;06162;de Ulises;59;444878;4478870;28043;913883701;CONSUELO DE VICENTE RENGEL;;PRIVADA CON ÁNIMO DE LUCRO
C3860;CASTELLAR, RESIDENCIA DE PERSONAS MAYORES;34;Plazas totales;CENTROS RESIDENCIALES;RESIDENCIAS DE PERSONAS MAYORES DEPENDIENTES;Personas mayores;079;Madrid;CALLE;05848;de Sierra Vieja;73;447142;4470036;28031;913808782;CLECE VITAM;A87045456;PRIVADA CON ÁNIMO DE LUCRO
C3861;HORTALEZA, CENTRO DE DIA;30;Capacidad máxima simultánea;CENTROS DE DÍA;CENTROS DE DÍA: OTROS;Personas con enfermedad mental crónica;079;Madrid;CALLE;03728;del Mar Báltico;11;445591;4480421;28033;913824636;ASOCIACION CANDELITA;G80586696;PRIVADA SIN ÁNIMO DE LUCRO
C3870;CENTRO MUNICIPAL DE MAYORES DE VILLANUEVA DEL PARDILLO;260;Capacidad máxima simultánea;CENTROS DE DÍA;HOGARES Y CLUBES;Personas mayores;177;Villanueva del Pardillo;CMNO;A0019;del Caño;1;418174;4482279;28229;918100270;AYUNTAMIENTO DE VILLANUEVA DEL PARDILLO;P2817700D;PÚBLICA
C3874;CENTRO OCUPACIONAL TRES CANTOS;50;Capacidad máxima simultánea;CENTROS OCUPACIONALES;CENTROS OCUPACIONALES GENÉRICOS;Personas con discapacidad intelectual;903;Tres Cantos;CALLE;00308;del Comercio;2;439675;4494399;28760;918036759;ASOCIACION EN FAVOR DE PERSONAS CON DISCAPACIDAD DE TRES CANTOS AMI-3;G80528235;PRIVADA SIN ÁNIMO DE LUCRO
C3879;CENTRO MUNICIPAL DE MAYORES ACUARIO;156;Capacidad máxima simultánea;CENTROS DE DÍA;HOGARES Y CLUBES;Personas mayores;079;Madrid;CALLE;00032;de Acuario;27;450863;4480616;28042;913010340;AYUNTAMIENTO DE MADRID;P2807900B;PÚBLICA
C3883;CARMEN LAFORET, CENTRO MUNICIPAL INTEGRADO PARA MAYORES;80;Capacidad máxima simultánea;CENTROS DE DÍA;CENTROS DE DÍA: OTROS;Personas mayores;079;Madrid;CALLE;08870;del Jazmín;46;443522;4481153;28033;917547725;AYUNTAMIENTO DE MADRID;P2807900B;PÚBLICA
C3890;ARANJUEZ CENTRO DE ATENCION TEMPRANA Y REHABILITACION;40;Capacidad máxima simultánea;CENTROS DE REHABILITACIÓN;CENTROS DE ATENCIÓN;Infancia;013;Aranjuez;CALLE;A0274;del Sol;12;448848;4430950;28300;918754883;ASOCIACION ARANJUEZ-PERSONAS CON DISCAPACIDAD INTELECTUAL;G28596138;PRIVADA SIN ÁNIMO DE LUCRO
C3891;CENTRO ESPECIFICO NUÑO GUTIERREZ ROMAN;20;Plazas totales;CENTROS RESIDENCIALES;OTRAS RESIDENCIAS;Infancia y Adolescencia;125;Robledo de Chavela;CALLE;00199;Lugano;101;;;28294;918998486;CONSULTING ASISTENCIAL SOCIOSANITARIO SL;B86486289;PRIVADA CON ÁNIMO DE LUCRO
C3901;DESENGAÑO, CENTRO DE DIA;40;Capacidad máxima simultánea;CENTROS DE DÍA;CENTROS DE DÍA: OTROS;Personas mayores;079;Madrid;CALLE;01683;del Desengaño;10;440374;4474706;28004;915322964;COMUNIDAD DE MADRID (CONSEJERIA DE POLITICAS SOCIALES, FAMILIAS, IGUALDAD Y NATALIDAD);S7800001E;PÚBLICA
C3907;AURORA VILLA, CENTRO DE DIA MUNICIPAL DE MAYORES;110;Capacidad máxima simultánea;CENTROS DE DÍA;CENTROS DE DÍA: OTROS;Personas mayores;079;Madrid;CALLE;04029;de Mercedes Arteaga;18;438755;4471705;28019;914725733;AYUNTAMIENTO DE MADRID;P2807900B;PÚBLICA
