numero_registro;denominacion;plazas_autorizadas_numero;plazas_descripcion;tipologia;subtipo;sector;municipio_codigo;municipio_nombre;direccion_via_tipo;direccion_via_codigo;direccion_via_nombre;direccion_portal;direccion_coor_x;direccion_coor_y;direccion_codigo_postal;contacto_telefono;entidad_denominacion;entidad_cif;entidad_naturaleza
C5745;APFMPS ENCUARTES, PISO TUTELADO;5;Plazas totales;CENTROS RESIDENCIALES;PISOS TUTELADOS;Personas con discapacidad intelectual;903;Tres Cantos;AVDA;00232;de los Encuartes;3;439730;4494141;28760;917345138;ASOCIACION DE PADRES Y FAMILIARES DE MINUSVALIDOS PSIQUICOS Y SENSORIALES INTEGRADOS EN EL INSTITUTO DE PSICO-PEDIATRIA DR. QUINTERO LUMBRERAS;G28812022;PRIVADA SIN ÁNIMO DE LUCRO
C5746;DISMA, OTRAS RESIDENCIAS;48;Plazas totales;CENTROS RESIDENCIALES;OTRAS RESIDENCIAS;Personas con discapacidad intelectual;079;Madrid;CALLE;45680;de Bahía de Pollensa;25;449827;4479528;28042;917479226-630100146;ENVERA-ASOCIACION DE EMPLEADOS DE IBERIA PADRES DE MINUSVALIDOS;G28641116;PRIVADA SIN ÁNIMO DE LUCRO
C5752;CASTILLO DE UCLES AYUNTAMIENTO DE MADRID, CENTRO DE DIA;45;Capacidad máxima simultánea;CENTROS DE DÍA;CENTROS DE DÍA: OTROS;Personas mayores;079;Madrid;CALLE;01231;del Castillo de Uclés;35;447120;4475821;28037;917547733;AYUNTAMIENTO DE MADRID;P2807900B;PÚBLICA
C5753;MORA DE RUBIELOS AYUNTAMIENTO DE MADRID, CENTRO DE DIA;45;Capacidad máxima simultánea;CENTROS DE DÍA;CENTROS DE DÍA: OTROS;Personas mayores;079;Madrid;PLAZA;E1296;de la Villa de Canillejas;4;448191;4477367;28022;917547731;AYUNTAMIENTO DE MADRID;P2807900B;PÚBLICA
C5768;ENCO, CENTRO DE DIA;35;Capacidad máxima simultánea;CENTROS DE DÍA;CENTROS DE DÍA: OTROS;Personas con discapacidad intelectual;079;Madrid;CALLE;45747;de Fromista;13;442832;4484622;28050;911727911 687908117;ASO. ALEPH-TEA Y FUNDACION APROCOR UTE;U87215117;PRIVADA CON ÁNIMO DE LUCRO
C5783;CIUDAD PEGASO AYUNTAMIENTO DE MADRID, CENTRO DE DIA;90;Capacidad máxima simultánea;CENTROS DE DÍA;CENTROS DE DÍA: OTROS;Personas mayores;079;Madrid;AVDA;07795;Quinta;5;449444;4477585;28022;917547734;AYUNTAMIENTO DE MADRID;P2807900B;PÚBLICA
C5788;PUERTA ABIERTA, CENTRO DE ACOGIDA;130;Plazas totales;CENTROS DE ACOGIDA;CENTROS DE ACOGIDA: OTROS;Personas sin hogar;079;Madrid;CALLE;C1575;del Pinar de San José;104;434120;4468389;28054;915112100;AYUNTAMIENTO DE MADRID;P2807900B;PÚBLICA
C5791;MARIA ZAMBRANO AYUNTAMIENTO DE MADRID, CENTRO DE MAYORES;164;Capacidad máxima simultánea;CENTROS DE DÍA;HOGARES Y CLUBES;Personas mayores;079;Madrid;PLAZA;04808;de los Pinazo;9;441355;4465990;28021;917100411;AYUNTAMIENTO DE MADRID;P2807900B;PÚBLICA
C5792;CASA DE ACOGIDA PANDORA;12;Plazas totales;CENTROS DE ACOGIDA;CENTROS DE MUJERES MALTRATADAS;Mujer;RESERVADO;RESERVADO;RESERVADO;RESERVADO;RESERVADO;RESERVADO;RESERVADO;RESERVADO;RESERVADO;RESERVADO;ASOCIACION TRABE INICIATIVAS PARA LA ECONOMIA SOCIAL Y SOLIDARIA;G84199132;PRIVADA SIN ÁNIMO DE LUCRO
C5793;MORATALAZ AYUNTAMIENTO DE MADRID, CENTRO DE DIA;65;Capacidad máxima simultánea;CENTROS DE DÍA;CENTROS DE DÍA: OTROS;Personas mayores;079;Madrid;CALLE;00596;del Arroyo Belincoso;13;444607;4473467;28030;913339755;AYUNTAMIENTO DE MADRID;P2807900B;PÚBLICA
C5795;ESCUELAS SAN ANTON AYUNTAMIENTO DE MADRID, CENTRO DE DIA;30;Capacidad máxima simultánea;CENTROS DE DÍA;CENTROS DE DÍA: OTROS;Personas mayores;079;Madrid;CALLE;05613;de Santa Brígida;12;440708;4475098;28004;919907716;AYUNTAMIENTO DE MADRID;P2807900B;PÚBLICA
C5796;MORATALAZ AYUNTAMIENTO DE MADRID, CENTRO DE MAYORES;561;Capacidad máxima simultánea;CENTROS DE DÍA;HOGARES Y CLUBES;Personas mayores;079;Madrid;CALLE;00596;del Arroyo Belincoso;13;444607;4473467;28030;913282656;AYUNTAMIENTO DE MADRID;P2807900B;PÚBLICA
C5802;ADOLFO SUAREZ, CENTRO DE DIA;60;Capacidad máxima simultánea;CENTROS DE DÍA;CENTROS DE DÍA: OTROS;Personas mayores;079;Madrid;CALLE;45497;de Ravena;18;447878;4474439;28032;913220900;AGENCIA MADRILEÑA DE ATENCION SOCIAL (AMAS);Q2801283I;PÚBLICA
C5805;PAUTA 1, PISO TUTELADO;10;Plazas totales;CENTROS RESIDENCIALES;PISOS TUTELADOS;Personas con discapacidad intelectual;079;Madrid;CALLE;45494;de Versalles;169;448113;4474390;28032;913135289;ASOCIACIÓN PAUTA (PSICOPEDAGOGÍA PARA AUTISMO Y TRASTORNOS ASOCIADOS);G80714520;PRIVADA SIN ÁNIMO DE LUCRO
C5813;RETO A LA ESPERANZA, RESIDENCIA DE PERSONAS MAYORES;24;Plazas totales;CENTROS RESIDENCIALES;RESIDENCIAS DE PERSONAS MAYORES MIXTA;Personas mayores;161;Valdemoro;CMNO;00661;Hondo;100;443159;4450773;28343;911615049 / 626277389;ASOCIACIÓN RETO A LA ESPERANZA;G39050984;PRIVADA SIN ÁNIMO DE LUCRO
C5814;FUNDACION GÖTZE: AVDA. EUROPA, PISO TUTELADO;8;Plazas totales;CENTROS RESIDENCIALES;PISOS TUTELADOS;Personas con discapacidad intelectual;115;Pozuelo de Alarcón;AVDA;A0265;Europa;7;432368;4476581;28224;913070058;FUNDACION GÖTZE;G28702686;PRIVADA SIN ÁNIMO DE LUCRO
C5816;HOGAR DOMINICAS VALDESANGIL, PISO TUTELADO  (EMANCIPACION);6;Plazas totales;CENTROS RESIDENCIALES;PISOS TUTELADOS;Otros grupos en situación de necesidad;079;Madrid;CALLE;10388;de Valdesangil;77;439226;4480158;28039;913167023-679838480;CONGREGACION DOMINICAS SANTÍSIMO SACRAMENTO;R1100014H;PRIVADA SIN ÁNIMO DE LUCRO
C5823;ANTONIO MACHADO AYUNTAMIENTO DE MADRID, CENTRO DE MAYORES;90;Capacidad máxima simultánea;CENTROS DE DÍA;HOGARES Y CLUBES;Personas mayores;079;Madrid;CALLE;07136;de San Román del Valle;8;447255;4474575;28037;917609942-913135296;AYUNTAMIENTO DE MADRID;P2807900B;PÚBLICA
C5824;CASTILLO DE UCLES AYUNTAMIENTO DE MADRID, CENTRO DE MAYORES;155;Capacidad máxima simultánea;CENTROS DE DÍA;HOGARES Y CLUBES;Personas mayores;079;Madrid;CALLE;01231;del Castillo de Uclés;35;447120;4475821;28037;913751151;AYUNTAMIENTO DE MADRID;P2807900B;PÚBLICA
C5825;CIUDAD PEGASO AYUNTAMIENTO DE MADRID, CENTRO DE MAYORES;90;Capacidad máxima simultánea;CENTROS DE DÍA;HOGARES Y CLUBES;Personas mayores;079;Madrid;PLAZA;40573;Mayor de Ciudad Pegaso;10;449473;4477589;28022;917432884;AYUNTAMIENTO DE MADRID;P2807900B;PÚBLICA
C5833;MATAELPINO, RESIDENCIA PERSONAS MAYORES;45;Plazas totales;CENTROS RESIDENCIALES;RESIDENCIAS DE PERSONAS MAYORES MIXTA;Personas mayores;023;Boalo, El;CALLE;00204;de los Ganaderos;11;419461;4509089;28492;918426968-69 / 619243233;RESISUVI SL;B87065389;PRIVADA CON ÁNIMO DE LUCRO
C5836;AFA ARGANDA MONTEALEGRE, CENTRO DE DIA;30;Capacidad máxima simultánea;CENTROS DE DÍA;CENTROS DE DÍA: OTROS;Personas mayores;014;Arganda del Rey;CALLE;A0255;Monte Alegre;11;459081;4462931;28500;918713322 625336549;ASOCIACION DE FAMILIARES DE ENFERMOS DE  ALZHEIMER DE ARGANDA;G83236844;PRIVADA SIN ÁNIMO DE LUCRO
C5837;CAMPAÑA CONTRA EL FRIO AYUNTAMIENTO DE MADRID, CENTRO DE ACOGIDA;150;Plazas totales;CENTROS DE ACOGIDA;CENTROS DE ACOGIDA: OTROS;Personas sin hogar;079;Madrid;CALLE;C1575;del Pinar de San José;106;434081;4468383;28054;915117108;AYUNTAMIENTO DE MADRID;P2807900B;PÚBLICA
C5838;PINAR DEL REY AYUNTAMIENTO DE MADRID, CENTRO DE MAYORES;81;Capacidad máxima simultánea;CENTROS DE DÍA;HOGARES Y CLUBES;Personas mayores;079;Madrid;CALLE;03477;de López de Hoyos;329;444427;4479662;28043;913000002;AYUNTAMIENTO DE MADRID;P2807900B;PÚBLICA
C5839;NTRA.SRA.DEL CARMEN AYUNTAMIENTO DE MADRID, CENTRO DE MAYORES;159;Capacidad máxima simultánea;CENTROS DE DÍA;HOGARES Y CLUBES;Personas mayores;079;Madrid;CALLE;11927;de Ramón Power;26;446460;4479379;28043;917160354;AYUNTAMIENTO DE MADRID;P2807900B;PÚBLICA
C5840;EL HENAR  AYUNTAMIENTO DE MADRID, CENTRO DE MAYORES;130;Capacidad máxima simultánea;CENTROS DE DÍA;HOGARES Y CLUBES;Personas mayores;079;Madrid;CALLE;09095;de Abizanda;8;444905;4480948;28033;913821494;AYUNTAMIENTO DE MADRID;P2807900B;PÚBLICA
C5841;CENTRO DE DIA INTEGRADO ALMOROX;100;Capacidad máxima simultánea;CENTROS DE DÍA;CENTROS DE DÍA: OTROS;Personas mayores;079;Madrid;CALLE;08406;de Almorox;S/N;;;28039;914598455;AYUNTAMIENTO DE MADRID;P2807900B;PÚBLICA
C5842;CAMPO REAL, RESIDENCIA DE PERSONAS MAYORES;106;Plazas totales;CENTROS RESIDENCIALES;RESIDENCIAS DE PERSONAS MAYORES DEPENDIENTES;Personas mayores;033;Campo Real;AVDA;00258;Arganda;1;467968;4465375;28510;918741009;AYUNTAMIENTO DE CAMPO REAL;P2803300I;PÚBLICA
C5843;BUCARAMANGA AYUNTAMIENTO DE MADRID, CENTRO DE MAYORES;130;Capacidad máxima simultánea;CENTROS DE DÍA;HOGARES Y CLUBES;Personas mayores;079;Madrid;AVDA;07486;de la Barranquilla;1;445752;4480431;28033;917632119;AYUNTAMIENTO DE MADRID;P2807900B;PÚBLICA
C5844;HUERTA DE LA SALUD AYUNTAMIENTO DE MADRID, CENTRO DE MAYORES;289;Capacidad máxima simultánea;CENTROS DE DÍA;HOGARES Y CLUBES;Personas mayores;079;Madrid;CALLE;03726;del Mar de las Antillas;10;445194;4480752;28033;913821801;AYUNTAMIENTO DE MADRID;P2807900B;PÚBLICA
C5845;NTRA.SRA.DE LA MERCED AYUNTAMIENTO DE MADRID, CENTRO DE MAYORES;254;Capacidad máxima simultánea;CENTROS DE DÍA;HOGARES Y CLUBES;Personas mayores;079;Madrid;PLAZA;09200;de Nuestra Señora del Tránsito;12;445009;4479052;28043;917161232;AYUNTAMIENTO DE MADRID;P2807900B;PÚBLICA
C5846;SAN BENITO AYUNTAMIENTO DE MADRID, CENTRO DE MAYORES;230;Capacidad máxima simultánea;CENTROS DE DÍA;HOGARES Y CLUBES;Personas mayores;079;Madrid;CALLE;10240;de Carrión de los Condes;73;444216;4480811;28033;913835937;AYUNTAMIENTO DE MADRID;P2807900B;PÚBLICA
C5847;ENTREVIAS AYUNTAMIENTO DE MADRID, CENTRO DE MAYORES;421;Capacidad máxima simultánea;CENTROS DE DÍA;HOGARES Y CLUBES;Personas mayores;079;Madrid;CALLE;06816;de Yuste;8;443251;4469675;28053;915887303;AYUNTAMIENTO DE MADRID;P2807900B;PÚBLICA
C5850;ASOCIACION BIENESTAR Y DESARROLLO YEBENES, PISO TUTELADO;4;Plazas totales;CENTROS RESIDENCIALES;PISOS TUTELADOS;Familia;079;Madrid;CALLE;08823;de Los Yébenes;207;436224;4471597;28047;912976482 662374221;ABD-ASOCIACIÓN BIENESTAR Y DESARROLLO;G59435180;PRIVADA SIN ÁNIMO DE LUCRO
C5851;SAN DIEGO AYUNTAMIENTO DE MADRID, CENTRO DE MAYORES;353;Capacidad máxima simultánea;CENTROS DE DÍA;HOGARES Y CLUBES;Personas mayores;079;Madrid;CALLE;03031;de Javier de Miguel;10;443675;4471112;28018;917571902;AYUNTAMIENTO DE MADRID;P2807900B;PÚBLICA
C5858;PIRAMIDES, CENTRO DE DIA;60;Capacidad máxima simultánea;CENTROS DE DÍA;CENTROS DE DÍA: OTROS;Personas mayores;079;Madrid;CALLE;08602;de Melilla;5;439715;4472602;28005;640131035 / 627118676-646337084;SANAMADRID SL;B87150249;PRIVADA CON ÁNIMO DE LUCRO
C5859;VIVIENDA PUENTE, VIVIENDA COMUNITARIA;8;Plazas totales;CENTROS RESIDENCIALES;VIVIENDAS COMUNITARIAS;Personas con enfermedad mental crónica;079;Madrid;CALLE;04499;de Palazuelos;51;447014;4469047;28031;913717292;FUNDACIÓN MANANTIAL;G81237257;PRIVADA SIN ÁNIMO DE LUCRO
C5862;ASOCIACION  APOYO POSITIVO ALCOCER, PISO TUTELADO;4;Plazas totales;CENTROS RESIDENCIALES;PISOS TUTELADOS;Mujer;079;Madrid;CALLE;00148;de Alcocer;5;440919;4466889;28021;913581444 650420965;ASOCIACION APOYO POSITIVO;G80672694;PRIVADA SIN ÁNIMO DE LUCRO
C5872;VALDECANILLAS GRUPO5, PISO TUTELADO;4;Plazas totales;CENTROS RESIDENCIALES;PISOS TUTELADOS;Personas sin hogar;079;Madrid;CALLE;06193;de Valdecanillas;29;446716;4475841;28037;686638594/918116374;GRUPO 5 ACCION Y GESTION SOCIAL S.A.U.;A78867371;PRIVADA CON ÁNIMO DE LUCRO
C5873;LUIS  RUIZ GRUPO 5, PISO TUTELADO;4;Plazas totales;CENTROS RESIDENCIALES;PISOS TUTELADOS;Personas sin hogar;079;Madrid;CALLE;03538;de Luis Ruiz;67;446040;4475522;28017;9181196374-686638594;GRUPO 5 ACCION Y GESTION SOCIAL S.A.U.;A78867371;PRIVADA CON ÁNIMO DE LUCRO
C5875;FUNDACIÓN MADRINA, PISO TUTELADO;6;Plazas totales;CENTROS RESIDENCIALES;PISOS TUTELADOS;Familia;079;Madrid;CALLE;03981;Mayor;37;439948;4474178;28013;914490690-652995945;FUNDACION MADRINA;G82875253;PRIVADA SIN ÁNIMO DE LUCRO
C5876;ANTON MARTIN AYUNTAMIENTO DE MADRID, CENTRO DE MAYORES;178;Capacidad máxima simultánea;CENTROS DE DÍA;HOGARES Y CLUBES;Personas mayores;079;Madrid;CALLE;00937;de la Cabeza;14;440361;4473703;28012;915273119;AYUNTAMIENTO DE MADRID;P2807900B;PÚBLICA
C5877;ACCEM PEÑA DE VARGAS, PISO TUTELADO;6;Plazas totales;CENTROS RESIDENCIALES;PISOS TUTELADOS;(Inmigracion) Otros grupos en situación de necesidad;079;Madrid;CALLE;04686;de Peña de Vargas;18;447167;4469472;28031;915327478;ACCEM;G79963237;PRIVADA SIN ÁNIMO DE LUCRO
C5880;JUAN LUIS VIVES, CENTRO MUNICIPAL DE ACOGIDA;132;Plazas totales;CENTROS DE ACOGIDA;CENTROS DE ACOGIDA: OTROS;Personas sin hogar;079;Madrid;CALLE;08028;del Alcalde Juan de Mata Sevillano;18;450350;4472198;28052;917602498-99;AYUNTAMIENTO DE MADRID;P2807900B;PÚBLICA
C5881;DOS AMIGOS AYUNTAMIENTO MADRID, CENTRO DE MAYORES;292;Capacidad máxima simultánea;CENTROS DE DÍA;HOGARES Y CLUBES;Personas mayores;079;Madrid;CALLE;01824;de los Dos Amigos;4;439753;4475142;28015;915885070 / 915426692;AYUNTAMIENTO DE MADRID;P2807900B;PÚBLICA
C5882;BENITO MARTIN LOZANO AYUNTAMIENTO MADRID, CENTRO DE MAYORES;144;Capacidad máxima simultánea;CENTROS DE DÍA;HOGARES Y CLUBES;Personas mayores;079;Madrid;CALLE;02120;de la Farmacia;13;440706;4475040;28004;915885070;AYUNTAMIENTO DE MADRID;P2807900B;PÚBLICA
C5888;ITACA, PISO TUTELADO DE ADOLESCENTES;12;Plazas totales;CENTROS RESIDENCIALES;PISOS TUTELADOS;Adolescencia;079;Madrid;CALLE;03393;de Laviana;8;446553;4475641;28037;638217997;AGENCIA MADRILEÑA DE ATENCION SOCIAL (AMAS);Q2801283I;PÚBLICA
C5897;LA RAMBLA, CENTRO DE MAYORES;258;Capacidad máxima simultánea;CENTROS DE DÍA;HOGARES Y CLUBES;Personas mayores;049;Coslada;AVDA;A0229;de los Príncipes de España;8;453329;4475213;28823;916278200-ext.3600;AYUNTAMIENTO DE COSLADA;P2804900E;PÚBLICA
C5908;FUNDACIÓN MADRINA GOBERNADOR CARLOS RUIZ, PISO TUTELADO;15;Plazas totales;CENTROS RESIDENCIALES;PISOS TUTELADOS;Familia;079;Madrid;PLAZA;07351;de Corpus Barga;6;443843;4471630;28053;914490690-652995945;FUNDACION MADRINA;G82875253;PRIVADA SIN ÁNIMO DE LUCRO
C5909;NUEVO COMIENZO, PISO TUTELADO;10;Plazas totales;CENTROS RESIDENCIALES;PISOS TUTELADOS;Mujer;RESERVADO;RESERVADO;RESERVADO;RESERVADO;RESERVADO;RESERVADO;RESERVADO;RESERVADO;RESERVADO;RESERVADO;ORGANIZACION NO GUBERNAMENTAL DE DESARROLLO FIET GRATIA;G86114741;PRIVADA SIN ÁNIMO DE LUCRO
C5910;FUNDACIÓN MADRINA SAN ISIDRO, PISO TUTELADO;6;Plazas totales;CENTROS RESIDENCIALES;PISOS TUTELADOS;Familia;080;Majadahonda;CALLE;01333;San Isidro;18;426277;4480636;28220;914490690-652995945;FUNDACION MADRINA;G82875253;PRIVADA SIN ÁNIMO DE LUCRO
C5911;GARGANTILLA DEL LOZOYA, CENTRO DE MAYORES;30;Capacidad máxima simultánea;CENTROS DE DÍA;HOGARES Y CLUBES;Personas mayores;063;Gargantilla del Lozoya y Pinilla de Buitrago;CMNO;;de Gargantilla al Molino;S/N;;;28739;918695013 / 918684431;AYUNTAMIENTO DE GARGANTILLA DE LOZOYA;P2806300F;PÚBLICA
C5914;LAS NINFAS, PISO TUTELADO;8;Plazas totales;CENTROS RESIDENCIALES;PISOS TUTELADOS;Personas con discapacidad intelectual;079;Madrid;CALLE;45224;de Almonte;1;446678;4469304;28031;664425359;FUNDACION CARLOS MARTIN;G82736323;PRIVADA SIN ÁNIMO DE LUCRO
C5915;LOS TULIPANES, PISO TUTELADO;7;Plazas totales;CENTROS RESIDENCIALES;PISOS TUTELADOS;Personas con discapacidad intelectual;079;Madrid;CALLE;45224;de Almonte;1;446678;4469304;28031;664425359;FUNDACION CARLOS MARTIN;G82736323;PRIVADA SIN ÁNIMO DE LUCRO
C5916;LOS SAUCES, PISO TUTELADO;7;Plazas totales;CENTROS RESIDENCIALES;PISOS TUTELADOS;Personas con discapacidad intelectual;079;Madrid;CALLE;45224;de Almonte;1;446678;4469304;28031;664425359;FUNDACION CARLOS MARTIN;G82736323;PRIVADA SIN ÁNIMO DE LUCRO
C5924;LOS CARMENES, CENTRO DE DIA;35;Capacidad máxima simultánea;CENTROS DE DÍA;CENTROS DE DÍA: OTROS;Personas mayores;079;Madrid;GTA;10581;de Los Cármenes;2;436885;4471852;28047;914208930;AGENCIA MADRILEÑA DE ATENCION SOCIAL (AMAS);Q2801283I;PÚBLICA
C5932;CAUCES, CENTRO DE DIA;60;Capacidad máxima simultánea;CENTROS DE DÍA;CENTROS DE DÍA: OTROS;Mujer;RESERVADO;RESERVADO;RESERVADO;RESERVADO;RESERVADO;RESERVADO;RESERVADO;RESERVADO;RESERVADO;RESERVADO;ASOCIACION MARILLAC;G80001779;PRIVADA SIN ÁNIMO DE LUCRO
C5933;ROSITA, RESIDENCIA DE PERSONAS MAYORES;21;Plazas totales;CENTROS RESIDENCIALES;RESIDENCIAS DE PERSONAS MAYORES MIXTA;Personas mayores;079;Madrid;CALLE;02951;de la Isla Saipán;43;;;28035;917793659 630812198;RESIDENCIA TERCERA EDAD ROSITA S.L.;B87848057;PRIVADA CON ÁNIMO DE LUCRO
C5934;ASPAR NTRA.SRA.DE LA SOLEDAD, CENTRO DE DIA;36;Capacidad máxima simultánea;CENTROS DE DÍA;CENTROS DE DÍA: OTROS;Personas mayores;014;Arganda del Rey;AVDA;10246;de Madrid;128;458915;4462402;28500;665868683;ASOCIACION NUESTRA SEÑORA DE LA SOLEDAD;G86017225;PRIVADA SIN ÁNIMO DE LUCRO
C5935;JUAN DE AUSTRIA,  RESIDENCIA;70;Plazas totales;CENTROS RESIDENCIALES;OTRAS RESIDENCIAS;Personas con discapacidad intelectual;079;Madrid;CALLE;00582;de Arturo Soria;12;445840;4476692;28027;913771519;AGENCIA MADRILEÑA DE ATENCION SOCIAL (AMAS);Q2801283I;PÚBLICA
C5939;FUNDACIÓN POLIBEA, CENTRO DE DÍA;125;Capacidad máxima simultánea;CENTROS DE DÍA;CENTROS DE DÍA: OTROS;Personas con discapacidad física;903;Tres Cantos;CALLE;00233;del Tagarral;2;440729;4493802;28760;918062770-657147421;FUNDACIÓN POLIBEA;G84469162;PRIVADA SIN ÁNIMO DE LUCRO
C5940;FUNDACION POLIBEA, OTRAS RESIDENCIAS;80;Plazas totales;CENTROS RESIDENCIALES;OTRAS RESIDENCIAS;Personas con discapacidad física;903;Tres Cantos;CALLE;00233;del Tagarral;2;440729;4493802;28760;918062770 / 657147421;FUNDACIÓN POLIBEA;G84469162;PRIVADA SIN ÁNIMO DE LUCRO
C5948;SAN BLAS HORTALEZA, CENTRO DE MAYORES;185;Capacidad máxima simultánea;CENTROS DE DÍA;HOGARES Y CLUBES;Personas mayores;079;Madrid;CALLE;;de Alfacar;8;;;28033;913821039;AGENCIA MADRILEÑA DE ATENCION SOCIAL (AMAS);Q2801283I;PÚBLICA
C5952;PUENTE DE VALLECAS-ALTO DEL ARENAL I, CENTRO DE MAYORES;180;Capacidad máxima simultánea;CENTROS DE DÍA;HOGARES Y CLUBES;Personas mayores;079;Madrid;CALLE;04700;de Perelada;1;445279;4471363;28038;914206051;AGENCIA MADRILEÑA DE ATENCION SOCIAL (AMAS);Q2801283I;PÚBLICA
C5953;PUENTE DE VALLECAS-ALTO DEL ARENAL II, CENTRO DE MAYORES;251;Capacidad máxima simultánea;CENTROS DE DÍA;HOGARES Y CLUBES;Personas mayores;079;Madrid;CALLE;04700;de Perelada;3;445299;4471377;28038;914206051;AGENCIA MADRILEÑA DE ATENCION SOCIAL (AMAS);Q2801283I;PÚBLICA
C5957;BELLAESCUSA, CENTRO DE DIA;20;Capacidad máxima simultánea;CENTROS DE DÍA;CENTROS DE DÍA: OTROS;Personas mayores;102;Orusco de Tajuña;CALLE;00179;Miguel Hernández;1;482427;4459575;28570;918761202-676450536;EDIFICIOS GERONTOLOGICOS, S.A.;A83000133;PRIVADA CON ÁNIMO DE LUCRO
C5958;SANTA MARIA DE LA CABEZA, VIVIENDA COMUNITARIA;8;Plazas totales;CENTROS RESIDENCIALES;VIVIENDAS COMUNITARIAS;Personas mayores;177;Villanueva del Pardillo;CALLE;A0093;Santa María de la Cabeza;20;419449;4481996;28229;912968040 / 678884506;VALERIA URDA TIMARU;;PRIVADA CON ÁNIMO DE LUCRO
C5961;JOVENES PROCEDENTES DE TUTELA, VIVIENDA COMUNITARIA (EMANCIPACION);6;Plazas totales;CENTROS RESIDENCIALES;VIVIENDAS COMUNITARIAS;Otros grupos en situación de necesidad;079;Madrid;CALLE;00105;de Alba de Tormes;10;436822;4469924;28025;915251676 / 639453052;ASOCIACION ALIANZA CRISTIANA DE JOVENES DE LA YMCA;G28659308;PRIVADA SIN ÁNIMO DE LUCRO
C5967;SANTA MARTA, OTRAS  RESIDENCIAS;33;Plazas totales;CENTROS RESIDENCIALES;OTRAS RESIDENCIAS;Infancia y Adolescencia;054;Escorial, El;CALLE;00937;de las Margaritas;1;406163;4489149;28219;"918965968; 627583569";CONSULTING ASISTENCIAL SOCIOSANITARIO SL;B86486289;PRIVADA CON ÁNIMO DE LUCRO
C5971;ACCEM CAMARENA, PISO TUTELADO;6;Plazas totales;CENTROS RESIDENCIALES;PISOS TUTELADOS;Refugiados y asilados;079;Madrid;CALLE;08719;de Camarena;75;435978;4471782;28047;915327478 - 627570775;ACCEM;G79963237;PRIVADA SIN ÁNIMO DE LUCRO
C5975;SAN JUAN BAUTISTA  AYUNTAMIENTO DE MADRID, CENTRO DE MAYORES;116;Capacidad máxima simultánea;CENTROS DE DÍA;HOGARES Y CLUBES;Personas mayores;079;Madrid;CALLE;00911;de Bueso Pineda;8;444208;4478187;28043;914157705;AYUNTAMIENTO DE MADRID;P2807900B;PÚBLICA
C5980;APRAMP, PISO TUTELADO;5;Plazas totales;CENTROS RESIDENCIALES;PISOS TUTELADOS;Mujer;RESERVADO;RESERVADO;RESERVADO;RESERVADO;RESERVADO;RESERVADO;RESERVADO;RESERVADO;RESERVADO;RESERVADO;ASOCIACION PARA ATENCION, PREVENCION Y REINSERCION DE LA MUJER PROSTITUIDA (APRAMP);G79414082;PRIVADA SIN ÁNIMO DE LUCRO
C5981;ISLAS FILIPINAS AYUNTAMIENTO DE MADRID, CENTRO DE MAYORES;175;Capacidad máxima simultánea;CENTROS DE DÍA;HOGARES Y CLUBES;Personas mayores;079;Madrid;CALLE;07004;de Nuestra Señora del Villar;6;444720;4474967;28017;914057222;AYUNTAMIENTO DE MADRID;P2807900B;PÚBLICA
C5982;OVIEDO  AFANIAS, PISO TUTELADO;3;Plazas totales;CENTROS RESIDENCIALES;PISOS TUTELADOS;Personas con discapacidad intelectual;079;Madrid;CALLE;04465;de Oviedo;18;440616;4477817;28020;914470116 669562174;AFANIAS, ASOCIACION PRO-PERSONAS CON DISCAPACIDAD INTELECTUAL;G28303790;PRIVADA SIN ÁNIMO DE LUCRO
C5985;ALDABA MADRID II, PISO TUTELADO;4;Plazas totales;CENTROS RESIDENCIALES;PISOS TUTELADOS;Personas con enfermedad mental crónica;079;Madrid;CALLE;10292;Transversal Sexta;2;440519;4465248;28021;914026258;FUNDACIÓN ALDABA;G82453606;PRIVADA SIN ÁNIMO DE LUCRO
C5998;FUNDACION ACRESCERE ARAVACA, VIVIENDA COMUNITARIA (EMANCIPACION);9;Plazas totales;CENTROS RESIDENCIALES;VIVIENDAS COMUNITARIAS;Otros grupos en situación de necesidad;079;Madrid;AVDA;10179;de la Osa Mayor;19;434025;4479071;28023;692731459;FUNDACION ACRESCERE;G85833341;PRIVADA SIN ÁNIMO DE LUCRO
C6004;COMEDOR SOCIAL SAN JUAN;60;Capacidad máxima simultánea;CENTROS DE DÍA;CENTROS DE DÍA: OTROS;Otros grupos en situación de necesidad;079;Madrid;CALLE;00749;de los Bascones;21;441023;4479981;28029;915417065;FUNDACION HOSPITALARIA DE LA ORDEN DE MALTA EN ESPAÑA;G78135498;PRIVADA SIN ÁNIMO DE LUCRO
C6009;GETAFE NORTE II APANID, PISO TUTELADO;8;Plazas totales;CENTROS RESIDENCIALES;PISOS TUTELADOS;Personas con discapacidad intelectual;065;Getafe;CALLE;A0308;Francisca Sauquillo;6;439332;4463919;28903;911639581-658192407;ASOCIACIÓN DE PADRES Y AMIGOS DE NIÑOS DIFERENTES DE GETAFE, COMUNIDAD DE MADRID Y TERRITORIO NACIONAL (APANID);G28389443;PRIVADA SIN ÁNIMO DE LUCRO
C6010;GRUPO 5 PORTO CRISTO, PISO TUTELADO;4;Plazas totales;CENTROS RESIDENCIALES;PISOS TUTELADOS;Personas con enfermedad mental crónica;007;Alcorcón;CALLE;00138;de Porto Cristo;8;430627;4466994;28924;918315414;GRUPO 5 ACCION Y GESTION SOCIAL S.A.U.;A78867371;PRIVADA CON ÁNIMO DE LUCRO
C6013;HOGAR DE EMANCIPACION DE ROQUETAS, PISO TUTELADO;5;Plazas totales;CENTROS RESIDENCIALES;PISOS TUTELADOS;Otros grupos en situación de necesidad;079;Madrid;CALLE;45091;de Roquetas de Mar;9;444337;4481282;28033;914411198 / 686741922;ASOCIACION NACIONAL DE HOGARES PARA NIÑOS PRIVADOS DE AMBIENTE FAMILIAR NUEVO FUTURO;G28309862;PRIVADA SIN ÁNIMO DE LUCRO
C6021;PAIDEIA SER18YMAS, VIVIENDA COMUNITARIA (EMANCIPACION);5;Plazas totales;CENTROS RESIDENCIALES;VIVIENDAS COMUNITARIAS;Otros grupos en situación de necesidad;079;Madrid;CALLE;08719;de Camarena;134;435800;4471425;28047;914295132-619762602 / 629 21 63 01;ASOCIACION PARA LA INTEGRACION DEL MENOR PAIDEIA;G78437688;PRIVADA SIN ÁNIMO DE LUCRO
C6022;CASA GARELLI-CARABANCHEL, VIVIENDA COMUNITARIA (EMANCIPACIÓN);8;Plazas totales;CENTROS RESIDENCIALES;VIVIENDAS COMUNITARIAS;Otros grupos en situación de necesidad;079;Madrid;CALLE;02531;de Joaquín Turina;18;436089;4469457;28044;625462896;FEDERACION DE PLATAFORMAS SOCIALES PINARDI;G83169524;PRIVADA SIN ÁNIMO DE LUCRO
C6023;CASA GARELLI-VICALVARO, VIVIENDA COMUNITARIA (EMANCIPACION);4;Plazas totales;CENTROS RESIDENCIALES;VIVIENDAS COMUNITARIAS;Otros grupos en situación de necesidad;079;Madrid;CALLE;45040;del Anillo Verde;48;448880;4473134;28032;625462896;FEDERACION DE PLATAFORMAS SOCIALES PINARDI;G83169524;PRIVADA SIN ÁNIMO DE LUCRO
C6026;ACCEM CAMARENA 3 D, PISO TUTELADO;6;Plazas totales;CENTROS RESIDENCIALES;PISOS TUTELADOS;Refugiados y asilados;079;Madrid;CALLE;08719;de Camarena;75;435978;4471782;28047;627570775;ACCEM;G79963237;PRIVADA SIN ÁNIMO DE LUCRO
C6027;EL BALCON, RESIDENCIA DE PERSONAS MAYORES;118;Plazas totales;CENTROS RESIDENCIALES;RESIDENCIAS DE PERSONAS MAYORES MIXTA;Personas mayores;161;Valdemoro;CALLE;C0035;Haití;2;440955;4448329;28341;918949870;ENGLISH CONNECTION MASTER SANSEGUNDO;B85712917;PRIVADA CON ÁNIMO DE LUCRO
C6032;EDALIA ARTURO SORIA, RESIDENCIA DE PERSONAS MAYORES;156;Plazas totales;CENTROS RESIDENCIALES;RESIDENCIAS DE PERSONAS MAYORES MIXTA;Personas mayores;079;Madrid;CALLE;00582;de Arturo Soria;278;443473;4480288;28033;913149499 605908683;GESTION INMUEBLES TERCERA EDAD SLU;B84127372;PRIVADA CON ÁNIMO DE LUCRO
C6033;CASA GARELLI-FUENCEMILLAN, VIVIENDA COMUNITARIA (EMANCIPACION);4;Plazas totales;CENTROS RESIDENCIALES;VIVIENDAS COMUNITARIAS;Otros grupos en situación de necesidad;079;Madrid;CALLE;07643;de Fuencemillán;18;451529;4477625;28022;625462896;FEDERACION DE PLATAFORMAS SOCIALES PINARDI;G83169524;PRIVADA SIN ÁNIMO DE LUCRO
C6038;CONVIVE COMPARTE, PISO TUTELADO;5;Plazas totales;CENTROS RESIDENCIALES;PISOS TUTELADOS;Familia;079;Madrid;CALLE;45501;de la República Checa;4;447676;4474513;28032;914049118 / 616574223;ASOCIACION ALTERNATIVA EN MARCHA;G80884422;PRIVADA SIN ÁNIMO DE LUCRO
C6039;HONDILLO NAVALAGAMELLA , PISO TUTELADO;4;Plazas totales;CENTROS RESIDENCIALES;PISOS TUTELADOS;Personas con enfermedad mental crónica;095;Navalagamella;CALLE;00194;Hondillo;12;404911;4480847;28212; 655985664;AURORA MATAS FERNANDEZ;;PRIVADA CON ÁNIMO DE LUCRO
C6051;JAVIER II, PISO TUTELADO;6;Plazas totales;CENTROS RESIDENCIALES;PISOS TUTELADOS;Presos y ex reclusos;079;Madrid;CALLE;09941;de Mudela;142;442432;4470113;28053;695566948;FUNDACION PADRE GARRALDA - HORIZONTES ABIERTOS;G83618850;PRIVADA SIN ÁNIMO DE LUCRO
C6055;HOGAR AVENIDA AMERICA, PISO TUTELADO (EMANCIPACION);5;Plazas totales;CENTROS RESIDENCIALES;PISOS TUTELADOS;Otros grupos en situación de necesidad;079;Madrid;CALLE;05439;de San Fernando del Jarama;4;442555;4476653;28002;915641958-690834663;FUNDACION ALICIA KOPLOWITZ;G83837286;PRIVADA SIN ÁNIMO DE LUCRO
